DOI,Author(s),Year,Paper Title,Link to paper,Paper ID,Reviewer,Status,Outcome(s) of Interest,Outcome(s) of Interest-sourcematerial,Drivers of Risk,Drivers of Risk-sourcematerial,Category,Category-sourcematerial,Approach,Approach-sourcematerial,Methodology,Methodology-sourcematerial,Highlights,Highlights-sourcematerial,More Notes,More Notes-sourcematerial,Hazard definition,Hazard definition-sourcematerial,Impact persistence,Impact persistence-sourcematerial,Space disaggregation,Space disaggregation-sourcematerial,Impact interactions,Impact interactions-sourcematerial,Economic dynamics,Economic dynamics-sourcematerial,Climate features,Climate features-sourcematerial,Adaptation considered,Adaptation considered-sourcematerial
10.1016/j.rser.2024.115073,Bamisile O. et al.,2025,The environmental factors affecting solar photovoltaic output,https://discovery.dundee.ac.uk/ws/portalfiles/portal/146761221/1-s2.0-S1364032124007998-main.pdf,10.1016/j.rser.2024.115073,AI,Step 6,"Reduced PV efficiency and output due to high temperatures, atmospheric conditions, extreme weather, and long-term irradiance changes.","raising module temperature reduces efficiency by 0.4–0.5 % per degree Celsius, limiting productivity in hotter climates; atmospheric conditions (clouds, aerosols, pollutants, and dust) can reduce electricity output by up to 60 %, especially in desert regions; extreme weather like wildfires and hailstorms cause substantial damage...long-term changes in solar irradiance, driven by climate change and air pollutants, present future challenges for maintaining PV efficiency","Solar irradiance, temperature, atmospheric conditions (clouds, aerosols, pollutants, dust), terrain effects (albedo, snow), extreme weather (wildfires, hailstorms, solar eclipses), long-term irradiance changes (climate change, air pollutants), wind, humidity, aerosol load.","Page 2: This review examines six key influences: solar irradiance, ambient temperature, atmospheric conditions, terrain effects, extreme weather events, and long-term irradiance changes. Page 4: Solar irradiance [34] directly impacts electricity output from PV modules, varying with time, location, climate, season, and topography [35]. Page 5: PV modules are sensitive to the spectral distribution of solar irradiance [42]. The Average Photon Energy (APE) metric assesses the effect of solar spectrum distribution on outdoor PV module performance [42]. Page 6: Solar insolation and ambient air temperature are the two main environmental factors affecting solar PV output [71]. Page 10: Dust accumulation on PV systems in desert regions. Cleaning can increase PV capacity factors by 50–100 % even if only performed quarterly. Page 12: Wind affects PV efficiency through cooling, soiling, and structural risk, with complex interactions occurring between wind and PV systems. Page 13: Climate change is increasing the severity of hailstorms and expanding the areas of the world affected. Page 16: solar irradiance, temperature, cloud cover, dust and pollutants, snow cover, albedo, and extreme weather events.",Energy,"The global expansion of solar photovoltaics (PV) is central to the global energy transition. This review examines six key influences: solar irradiance, ambient temperature, atmospheric conditions, terrain effects, extreme weather events, and long-term irradiance changes. [...] Optimizing PV systems for diverse climates and mitigating environmental impacts on productivity is important to the continued success of solar photovoltaics. This review highlights the need for tailored strategies to maintain performance in varied and evolving environmental contexts.

Page 4: Evaluation overview: Solar irradiance [34] directly impacts electricity output from PV modules, varying with time, location, climate, season, and topography [35]. It affects PV cell performance characteristics, including open-circuit voltage, short-circuit current, cell temperature, and efficiency [28].

Page 7: ""The I-V and P-V characteristics in Fig. 9 demonstrate a slight increase in short-circuit current and a large decrease in open-circuit voltage as temperature rises, reducing power output and thus efficiency."" 

Page 16: Evaluation overview: ""This review examined the many environmental factors that influence solar PV performance."" Drivers of Risk: ""solar irradiance, temperature, cloud cover, dust and pollutants, snow cover, albedo, and extreme weather events.""
",Other,"Page 2: Comprehensive review examining six key influences on solar PV performance. Page 3: The paper evaluates solar PV performance under Standard Test Conditions (STC) and Photovoltaics for Utility Scale Application Test Conditions (PTC), highlighting differences due to actual environmental conditions. Page 4: Analysis of solar irradiance intensity on PV module performance, current-voltage (I-V) and power-voltage (P-V) curves. Page 5: The paper discusses the use of Average Photon Energy (APE) to assess the effect of solar spectrum distribution on outdoor PV module performance. Page 7: Analysis based on I-V and P-V characteristics and temperature coefficient data of solar PV modules. Page 15: The analysis visualizes capacity factor trends using line graphs over specified periods around solar eclipses in Western Australia and the United States, with 5-minute and 1-hour resolution data. Page 16: Analysis includes correlation studies on aerosol emissions and solar irradiance based on satellite data from the 1980s onward.","Several methodologies are used to evaluate solar PV performance, including assessments under Standard Test Conditions (STC) and Photovoltaics for Utility Scale Application Test Conditions (PTC) which highlight the influence of real environmental conditions; analysis of I-V and P-V curves to study the impact of solar irradiance intensity; application of the Average Photon Energy (APE) metric to understand the effect of solar spectrum distribution; and examination of temperature coefficients from various cell technologies to assess performance changes under different temperatures. The paper also discusses cleaning methods (mechanical, self-cleaning, electrostatic, and natural) for dust removal. Utilizes satellite data since the 1980s to correlate aerosol emissions and solar irradiance. Examines solar PV performance during eclipses with specific resolution data in different regions.","Page 3: The paper evaluates solar PV performance under Standard Test Conditions (STC) and Photovoltaics for Utility Scale Application Test Conditions (PTC), highlighting differences due to actual environmental conditions.; Page 4: Analysis of solar irradiance intensity on PV module performance, current-voltage (I-V) and power-voltage (P-V) curves.; Page 5: The paper discusses the use of Average Photon Energy (APE) to assess the effect of solar spectrum distribution on outdoor PV module performance.; Page 7: Analysis based on I-V and P-V characteristics and temperature coefficient data of solar PV modules.; Page 10: Classification of cleaning methods into mechanical, self-cleaning, electrostatic, and natural.; Page 16: Since the advent of the satellite era in the 1980s, more accurate aerosol concentration records have clarified the relationship between aerosol load and the observed increase in solar irradiance since the late 20th century [264].; Page 15: Fig. 21. Average capacity factor of PV systems during total solar eclipses compared to their surrounding days in (a) Western Australia and (b) the United States.",Aerosol load reduction improves solar irradiance; Irradiance directly impacts electricity output and varies across locations; High temperatures degrade modules; Cleaning improves capacity factors in dusty regions; Solar eclipses cause short-term productivity losses.,"Page 16: ""This more direct evidence strongly indicates that aerosol load driving the decadal changes in solar irradiance, and so efforts to improve air quality such as reducing the SO2 limit on shipping fuel [271] will likely improve solar PV capacity factors in future [264].""; Page 4: ""Solar irradiance [34] directly impacts electricity output from PV modules, varying with time, location, climate, season, and topography [35].""; Page 6: ""Whereas irradiance has a stronger effect on current, temperature predominantly affects voltage. Furthermore, solar modules at high temperature experience more rapid degradation and lower lifetimes [69,70].""; Page 10: ""Cleaning is a major operating expense in desert regions ... but can increase PV capacity factors...""; Page 15: ""Should a similar occurrence transpire in regions with more concentrated PV capacity, such as California (42 GW installed) [240], or Japan (83 GW installed) [5], the impact on power system operations could be difficult to manage.""","Upcoming solar eclipses in Spain (2026), Chile and Argentina (2027), North Africa and the Middle East (2027), Indonesia and Australia (2028), and Northern China (2030) will impact solar PV production.","Page 15: ""The next major eclipses that will affect solar PV production will be in Spain on 12 August 2026, Chile and Argentina on 6 February 2027, North Africa and Middle East countries on 2 August 2027, Indonesia and Australia on 22 July 2028, and Northern China on 1 June 2030 [241].""",Acute shocks,"Page 2: This review examines six key influences: solar irradiance, ambient temperature, atmospheric conditions, terrain effects, extreme weather events, and long-term irradiance changes. ...extreme weather like wildfires and hailstorms cause substantial damage, while solar eclipses lead to large but short-lived output losses.",Adaptive,"Climate change will affect many of the factors that reduce solar PV performance, including increasing humidity and frequency of wildfires and hailstorms as discussed in the previous sections.",Regional,"Page 15: Analysis visualizes capacity factor trends using line graphs over specified periods around solar eclipses in Western Australia and the United States, with 5-minute and 1-hour resolution data.",,"
Page 12:  
Wind affects PV efficiency through cooling, soiling, and structural risk, with complex interactions occurring between wind and PV systems. Wind increases efficiency by cooling modules, especially during peak sunlight hours [168,169], and reduces soiling by blowing away accumulation of dust and snow [131,170]. However, wind can also deposit dust or snow [118, 134], and keeps particles airborne, causing light scattering [170]. Extreme winds conditions can compromise structural security [171,172], requiring adequate design margins.
",,"Page 2: The global expansion of solar photovoltaics (PV) is central to the global energy transition. This review examines six key influences: solar irradiance, ambient temperature, atmospheric conditions, terrain effects, extreme weather events, and long-term irradiance changes.",Other,"This review examines six key influences: solar irradiance, ambient temperature, atmospheric conditions, terrain effects, extreme weather events, and long-term irradiance changes. Climate change will affect many of the factors that reduce solar PV performance, including increasing humidity and frequency of wildfires and hailstorms as discussed in the previous sections. Finally, long-term changes in solar irradiance, driven by climate change and air pollutants, present future challenges for maintaining PV efficiency. This review highlights the need for tailored strategies to maintain performance in varied and evolving environmental contexts.","Adaptation strategies are addressed through optimizing PV systems for diverse climates, incorporating temperature coefficient data for performance variations, and utilizing cleaning methods like self-cleaning and electrostatic techniques to mitigate dust impacts. Wind dynamics are considered for cooling and soiling balance, and structural design margins are suggested for extreme wind conditions. The analysis also links aerosol reduction to improved solar irradiance, suggesting future adaptation for PV performance enhancement.","""Optimizing PV systems for diverse climates and mitigating environmental impacts on productivity is important to the continued success of solar photovoltaics.""; ""The analysis discusses performance variations under varying temperature conditions using temperature coefficients for different PV technologies.""; ""Utilization of self-cleaning and electrostatic cleaning methods in dust removal from solar panels.""; ""Wind affects PV efficiency through cooling, soiling, and structural risk... Extreme winds conditions can compromise structural security [171,172], requiring adequate design margins.""; ""efforts to improve air quality such as reducing the SO2 limit on shipping fuel [271] will likely improve solar PV capacity factors in future."""
10.1016/j.jpolmod.2021.10.001,Alestra et al.,2022,Growth impact of climate change and response policies: The advanced climate change long-term (ACCL) model,maxattempt,10.1016/j.jpolmod.2021.10.001,AI,Step 6,"GDP damage due to climate change, GDP impact of mitigation measures, Total Factor Productivity (TFP).","""This paper provides a tool to build climate change scenarios to forecast Gross Domestic Product (GDP), modelling both GDP damage due to climate change and the GDP impact of mitigating measures...Compared to other models, it provides a comprehensive modelisation of Total Factor Productivity (TFP), which is the most significant determinant of the GDP projected path.""","CO2 emissions, energy inputs, Total Factor Productivity (TFP), discount rate, international cooperation.","""Five different types of energy inputs are taken into account according to their CO2 emission factors... Compared to other models, it provides a comprehensive modelisation of Total Factor Productivity (TFP), which is the most significant determinant of the GDP projected path... They illustrate both the tragedy of the horizon and the tragedy of the commons, which call for a policy framework that adequately integrates a long run perspective, through a low-enough discount rate and an effective intergenerational solidarity as well as international cooperation.""",Productivity > TFP,"This paper provides a tool to build climate change scenarios to forecast Gross Domestic Product (GDP)... Compared to other models, it provides a comprehensive modelisation of Total Factor Productivity (TFP), which is the most significant determinant of the GDP projected path.",Macro-model,"This paper provides a tool to build climate change scenarios to forecast Gross Domestic Product (GDP), modelling both GDP damage due to climate change and the GDP impact of mitigating measures. It adopts a supply-side, long-term view, with 2060 and 2100 horizons. It is a global projection tool (30 countries/regions)...Compared to other models, it provides a comprehensive modelisation of Total Factor Productivity (TFP), which is the most significant determinant of the GDP projected path. We present simulation results of different energy policy scenarios.","A supply-side, long-term (2060, 2100) global (30 countries/regions) projection tool models GDP, incorporating climate change damage, mitigation impacts, and five energy input types with CO2 emission factors; it features full calibration and a comprehensive modelisation of Total Factor Productivity (TFP).","""This paper provides a tool to build climate change scenarios to forecast Gross Domestic Product (GDP), modelling both GDP damage due to climate change and the GDP impact of mitigating measures. It adopts a supply-side, long-term view, with 2060 and 2100 horizons. It is a global projection tool (30 countries/regions), with assumptions and results both at the world and the country/regional level. Five different types of energy inputs are taken into account according to their CO2 emission factors. Full calibration is possible at each stage, with estimated or literature-based default parameters. Compared to other models, it provides a comprehensive modelisation of Total Factor Productivity (TFP), which is the most significant determinant of the GDP projected path.""","Provides a global GDP projection tool (2060 & 2100 horizons, 30 regions) modeling climate change damage and mitigation impacts, factoring in energy inputs and comprehensively modeling Total Factor Productivity, highlighting the need for long-run policy integration and international cooperation due to the tragedies of the horizon and commons.","""This paper provides a tool to build climate change scenarios to forecast Gross Domestic Product (GDP), modelling both GDP damage due to climate change and the GDP impact of mitigating measures...It is a global projection tool (30 countries/regions), with 2060 and 2100 horizons...Five different types of energy inputs are taken into account...Compared to other models, it provides a comprehensive modelisation of Total Factor Productivity (TFP)...They illustrate both the tragedy of the horizon and the tragedy of the commons, which call for a policy framework that adequately integrates a long run perspective...as well as international cooperation.""","Presents a global GDP forecasting tool (30 regions) to model climate change damage and mitigation impacts, emphasizing long-term (2060, 2100) supply-side dynamics, diverse energy inputs, and comprehensive Total Factor Productivity modeling, highlighting the need for long-run policy frameworks with low discount rates and international cooperation to address the tragedies of the horizon and commons.","""This paper provides a tool to build climate change scenarios to forecast Gross Domestic Product (GDP), modelling both GDP damage due to climate change and the GDP impact of mitigating measures...It is a global projection tool (30 countries/regions)...Five different types of energy inputs are taken into account according to their CO2 emission factors...Compared to other models, it provides a comprehensive modelisation of Total Factor Productivity (TFP)...We present simulation results of different energy policy scenarios. They illustrate both the tragedy of the horizon and the tragedy of the commons, which call for a policy framework that adequately integrates a long run perspective, through a low-enough discount rate and an effective intergenerational solidarity as well as international cooperation.""",,"The abstract focuses on economic modeling of GDP under climate change and mitigation policies, without explicitly mentioning any specific climate hazards.",,"The abstract focuses on GDP forecasting, energy policy scenarios, and Total Factor Productivity (TFP). It does not explicitly discuss the persistence of climate change impacts.",Regional,"It is a global projection tool (30 countries/regions), with assumptions and results both at the world and the country/regional level.",,"The abstract focuses on modeling GDP, energy inputs, CO2 emissions, Total Factor Productivity (TFP), and energy policy scenarios. It does not mention interactions between direct climate impacts.",Transitional (accounting for changes over time),"This paper provides a tool to build climate change scenarios to forecast Gross Domestic Product (GDP), modelling both GDP damage due to climate change and the GDP impact of mitigating measures. It adopts a supply-side, long-term view, with 2060 and 2100 horizons...Compared to other models, it provides a comprehensive modelisation of Total Factor Productivity (TFP), which is the most significant determinant of the GDP projected path. We present simulation results of different energy policy scenarios.",,"The abstract focuses on GDP forecasting, energy policy scenarios, and Total Factor Productivity, without mentioning tipping points or other climate complexities directly.","The paper models the GDP impact of mitigating measures, suggesting adaptation is considered indirectly through its effect on mitigation policies and resulting GDP impacts. It also emphasizes the need for policy frameworks that integrate a long-run perspective, which could include adaptation strategies.","""modelling both GDP damage due to climate change and the GDP impact of mitigating measures,"" ""They illustrate both the tragedy of the horizon and the tragedy of the commons, which call for a policy framework that adequately integrates a long run perspective"""
