DOI,Author(s),Year,Paper Title,Link to paper,Paper ID,Reviewer,Status,Country(ies),Outcome(s) of Interest,Drivers of Risk,Scenario(s),Methodology,Highlights,More Notes,Applicability,Calibration Approach,Hazard definition,Impact persistence,Space disaggregation,Impact interactions,Economic dynamics,Climate features,Adaptation considered,Impacted Sector,Benefits of Adaptation,Costs of Adaptation,Ante/Post?,Planning Process,"""Soft Options""",Sufficiency Definition,Soft Options
10.1016/j.envsoft.2015.03.010,Estrada F. et al.,2015,The persistence of shocks in GDP and the estimation of the potential economic costs of climate change,found,10.1016/j.envsoft.2015.03.010,AI,Step 5,12 groups of countries (using data from the Maddison database).,"GDP, Total Factor Productivity (TFP), Economic Impacts (percentage of GDP, net present value), Productivity Loss, Capital Accumulation, Persistence of GDP Shocks, Costs and Benefits of Climate Change/Adaptation.",Climate change impacts; GDP shocks (direct/indirect); Economic growth model variables; Investment returns; Health effects; Adaptation processes; Productivity; Structural breaks in GDP; Climate system discontinuity; Rate of climate change; Sea level rise; Global temperature increase; RCP4.5 and RCP8.5 scenarios; Persistence of shocks; Natural disasters.,"RCP scenarios, DICE, PAGE2002, FUND.","The analysis employs a mixed-methods approach, combining econometric analysis of historical GDP data with Integrated Assessment Models (IAMs). The econometric component utilizes unit root tests (ADF, Kim and Perron, Perron and Yabu) and Autoregressive models (AR(p), AR(1)) to assess the persistence of generic GDP shocks using the Maddison database. The IAM component, using models such as DICE (Solow growth, Cobb-Douglas production), PAGE2002, and FUND, models climate change impacts as shocks to GDP. The methodology involves simulating various climate change scenarios with different persistence parameters and damage functions to estimate economic impacts and analyze equilibrium and disequilibrium dynamics. Cost-benefit analysis is implied as part of the IAM evaluation.","Climate change impacts, particularly those related to sea-level rise, can have persistent and potentially permanent effects on GDP, leading to significantly larger economic losses than previously estimated. Macroeconomic impacts are highly sensitive to the assumed persistence of shocks and the inclusion of ""memory"" parameters in models, with higher persistence leading to much greater cost estimates. Existing Integrated Assessment Models (IAMs) may underestimate costs by implicitly assuming low persistence, which is not supported by empirical data showing structural breaks in GDP. Regional variations in vulnerability and economic impacts are also significant. The exact level of persistence and dynamics of climate change impacts remain uncertain, but failing to account for them adequately can lead to serious underestimation of climate change costs.","IAMs typically model climate change as direct GDP shocks, impacting long-term growth differently depending on how temporal dynamics are treated. A key uncertainty lies in the persistence of these shocks, often assumed to be similar to general GDP shocks. Models like FUND incorporate persistence through specific modules (e.g., agriculture, sea-level rise), while others like DICE have zero persistence in their impact modules, though model dynamics can impart some persistence to GDP shocks. Regional impact differences are significant and depend on shock persistence and adaptation measures. Some IAMs assume zero persistence, implying substantial, costless adaptation and limitless resilience.",Macroeconomic/Fiscal,,Stylised changes,Adaptive,Regional,Sequential Interactions,Transitional (accounting for changes over time),Other,"Indirectly, through IAMs that model climate change impacts as an aggregated direct shock to baseline GDP, utilizing impact functions within IAMs, and simulating persistence of climate shocks. Some IAMs incorporate cost-benefit analysis.",,,,,,,,
10.1073/pnas.1222465110,Nelson G.C. et al.,2014,Climate change effects on agriculture: Economic responses to biophysical shocks,found,10.1073/pnas.1222465110,AI,Step 5,,,,,,,,,,,,,,,,,,,,,,,,
10.1007/s10584-010-9956-9,Brown C. et al.,2011,Hydroclimate risk to economic growth in sub-Saharan Africa,found,10.1007/s10584-010-9956-9,AI,Step 5,"India, Ethiopia, Cameroon, Sub-Saharan Africa (SSA), 42 Sub-Saharan African countries","Economic growth (national, per capita, GDP, agricultural GDP, industrial GDP), agricultural productivity/production/value added, industrial value added, household income, welfare, poverty (headcount, $1/day, $2/day), investment, livelihood, economic activity/output/development, income inequality, ecosystem impacts, infrastructure impacts, water resources impacts.","Climate variability, rainfall variability, hydroclimatic variability (floods, droughts, wet/dry seasons, ENSO), temperature changes, precipitation changes, climate anomalies (rainfall, temperature), climate extremes (droughts, floods), anthropogenic climate change (GHG emissions), sensitivity factors (agriculture, infrastructure, insurance), geographic challenges, poor institutions, covariant risks, unmanaged climate risk, hydrometeorologic risks, water-related threats, drought indices (WASP), economic factors (funding, social protection programs).","The analysis used fixed effects, random effects, and OLS regressions. It also employed a precipitation-based index called WASP, defining drought and flood risk based on thresholds of this index.","The analysis of macroeconomic and macro-fiscal risks of climate change and adaptation costs and benefits relies heavily on regression analysis (cross-country, panel, fixed effects, random effects, OLS), often incorporating a Weighted Anomaly Standardized Precipitation (WASP) index to capture spatial and temporal precipitation variability at a subnational level. WASP is used as a measure of drought and water availability, with thresholds to account for non-linear responses. Data sources include national-level economic and climate data, subnational economic output databases, and panel data from various regions (e.g., Sub-Saharan Africa, India, Ethiopia). Methodologies also involve case studies, climate change studies, surveys, and Ricardian analysis. A key focus is econometric analysis to assess the impact of climate variables (temperature, precipitation, WASP) on economic growth, agricultural GDP, industrial GDP, and livelihood indicators. The general regression specification often takes the form Yi = βXi + µVi+ εi, with careful consideration of standard error clustering (country-level) and assumptions regarding time-invariant characteristics and country effects.","Climate change, particularly hydroclimatic variability and drought, poses significant macroeconomic and macro-fiscal risks, especially in Sub-Saharan Africa (SSA). Drought is a primary concern, negatively impacting GDP, agricultural and industrial output, household income, and contributing to poverty. Rainfall variability is a dominant source of consumption risk for rainfed agriculture. While the effects of climate change on global economic growth are inconclusive, developing countries, particularly SSA, show distinct vulnerabilities and responses compared to developed nations. Developed countries mitigate these risks through infrastructure investments. Climate variability is sometimes more important than climate means and can represent a substantial handicap to economic output. Models indicate that drought indices are consistently significant predictors of economic growth. Temperature's impact is less consistent, particularly when precipitation is considered. Addressing hydroclimatic risks in SSA is crucial for economic growth, requiring diversified interventions. The impact of climate differs across countries, suggesting variations in capacity to manage climate risks.","Focusing on Sub-Saharan Africa (SSA), the study investigates the macroeconomic and fiscal implications of climate change, particularly the impact of rainfall variability and drought on economic growth and vulnerability. It acknowledges data limitations, especially regarding flood data, and emphasizes the importance of considering the full annual rainfall cycle and higher-order statistics of rainfall. SSA's vulnerability stems from dependence on agriculture, limited resources, and susceptibility to climate-exacerbated diseases. The analysis explores differential climate changes and varying capacities to manage these challenges across SSA countries, examining current vulnerabilities and adaptation planning. While household-level impacts are emphasized, the study notes their potential aggregate macroeconomic and fiscal consequences, especially in agrarian economies. Methodologically, the research employs panel data and fixed effects to address unobserved heterogeneity, controlling for time-invariant country characteristics. The analysis concentrates on hydroclimatic variability, particularly rainfall, and its lagged impacts, acknowledging the potential for underestimation of flood effects and the importance of considering rainfall variability, not just mean changes, in economic projections. The impact of climate on industrial GDP is considered through agriculture and hydroelectricity.",Macroeconomic/Fiscal,Econometric,Acute shocks,Adaptive,Regional,Spatial Interactions,Transitional (accounting for changes over time),Other,"Adaptation to climate change is considered through statistical and econometric analyses assessing the impact of climate variability, particularly precipitation and temperature, on economic growth and GDP at the national level. Methodologies include cross-country and panel regressions, with significant use of the WASP index to evaluate precipitation anomalies and their effects on economic outcomes. The analysis involves examining specific regions, such as Sub-Saharan Africa, using both fixed and random effects models to control for time-invariant factors and to capture spatial variability. Studies focus on GDP growth, livelihood indicators, and sector-specific impacts (e.g., agriculture) related to climate change incentives and adjustments.",,,,,,,,
10.3390/ijerph8124386,Trærup S.L.M. et al.,2011,The costs of climate change: A study of cholera in Tanzania,found,10.3390/ijerph8124386,AI,Step 5,Tanzania,Tanzania; climate change; cholera; costs; GDP impact (0.32-1.4% by 2030); reactive adaptation costs (0.03-0.12% GDP); productivity losses; value of lost lives (VOSL); diarrheal diseases.,Climate change; temperature increase; rainfall changes; cholera incidence; diarrheal diseases; Tanzania; seasonal patterns; GDP; socio-economic factors; climate variability.,1°C and 2°C temperature increase by 2030.,"Methodology: The study assesses the macroeconomic risks of climate change-induced cholera in Tanzania by integrating historical climate data (temperature and rainfall) with cholera incidence, controlling for socioeconomic development. It projects cholera burden attributable to climate change by 2030 using econometric analyses within the Chiabai et al. framework, linking climate change, population growth, and economic development. Future cholera deaths are estimated by downscaling regional diarrheal death projections, applying Tanzania's cholera/diarrheal death ratio, and using a case fatality rate to estimate cases. Economic costs are calculated by multiplying climate change-attributable cases by the unit cost per case (reactive adaptation), and productivity losses are estimated based on lost workdays and wages. A GDP-adjusted Value of Statistical Life (VOSL) is used for mortality costs. Scenarios of 1°C and 2°C temperature increases by 2030 inform projections, using both annual and monthly data to generate cost boundaries. Cost estimates rely on Tanzanian Ministry of Health data and exclude preventative measure costs assuming integration within general socio-economic development and autonomous adaptation effects. The study accounts for future economic development, including health system strengthening, in its national-level assessment.","Highlights: A study on Tanzania estimates the national-level costs of climate change-induced cholera and the benefits of adaptation. Temperature increases are positively correlated with cholera cases. Reactive adaptation costs for cholera management in Tanzania could be reduced by 44-47% if temperature increase is limited to 1°C instead of 2°C. By 2030, these costs are estimated at 0.03-0.12% of GDP, with loss of lives accounting for 90% of the total. These costs are significantly higher than current budgets for diarrheal diseases. Economic development is expected to positively influence health sector performance.","Focuses on the economic impact of cholera in Tanzania, considering productivity losses and deaths. The study uses the WHO's case fatality rate due to unreliable econometric results and addresses seasonality with a drought month dummy variable. It analyzes the costs of reactive adaptation measures only, assuming preventive measures align with Tanzania's development goals, including near-universal water and sanitation by 2025. The analysis acknowledges data limitations and emphasizes the need for national and local level quantification of disease burden due to varying vulnerabilities, and notes that distributional impacts of adaptation measures are often challenged, disadvantaging those with low bargaining power. The rainfall graph within the paper provides seasonal context relevant to disease spread.",Adaptation,,,,,,,,,"The health sector is specifically impacted, as the study focuses on the impact of climate change on cholera incidence and the associated economic costs in Tanzania.","The study quantifies adaptation benefits by estimating the avoided costs of climate change-attributable cholera cases and deaths in Tanzania. This involves projecting future cholera burden based on climate scenarios and socioeconomic factors, then calculating the costs of reactive adaptation (treatment) and the economic impacts of the disease (productivity losses and mortality, using a GDP-adjusted VOSL). The difference between costs without and with adaptation provides a measure of the benefits. However, the study does not include the costs or benefits of preventative adaptation as these are assumed to occur with general socio-economic development.","The study quantifies adaptation costs reactively, focusing on cholera cases attributable to climate change. It multiplies the projected number of these cases by the unit cost per case. Productivity losses due to illness are calculated based on daily wages and days out of work. Loss of life is valued using a GDP-adjusted Value of Statistical Life (VOSL). Preventative adaptation costs are not explicitly included, assuming they are integrated with general socio-economic development. The study does not account for autonomous adaptation.","The analysis primarily relies on ex-ante modeling, as it involves projections of future cholera burden and economic costs attributable to climate change by 2030, based on scenarios of temperature increase and socioeconomic factors. The study integrates historical data but emphasizes future projections and scenario modeling.","The paper, focusing on Tanzania and published in 2011, doesn't directly address adaptation planning/decision-making processes. It assesses the costs of reactive adaptation to climate change-attributable cholera cases, productivity losses, and loss of lives. Preventative measures are assumed to be implemented with general socio-economic development, and autonomous adaptation at the individual/household/community level is not considered. The study integrates climate projections with health and socioeconomic data to estimate future cholera burden and its economic costs, but it does not delve into the planning or decision-making behind adaptation strategies.","The study on Tanzania did not explicitly focus on ""soft options"" such as informational and institutional interventions; instead, it concentrated on reactive adaptation costs, productivity losses, and the economic impacts of choleral cases attributable to climate change. However, it implied that preventative measures, potentially including ""soft options"", were assumed to be implemented with general socioeconomic development. This suggests that these interventions could be integral to the broader strategy of reducing vulnerability to cholera, albeit not directly specified or analyzed in the study's cost estimation. The importance of strengthening health systems, a possible outcome of institutional interventions, was considered in the national-level assessment of future economic developments, pointing to indirect acknowledgment of their benefits.","This paper focuses on the economic costs of climate change-induced cholera in Tanzania. It doesn't explicitly define ""sufficient adaptation levels."" Instead, it estimates the economic costs *after* reactive adaptation (treatment of cholera cases) but *before* preventative adaptation, which it assumes will be integrated into general socioeconomic development and strengthening of the health system. Therefore, ""well-adapted"" in this context would imply a state where the remaining (post-reactive adaptation) cholera burden attributable to climate change is minimized, ideally approaching zero through broader development efforts. The study does not quantify preventative adaptation costs, making it difficult to determine the level needed for 'sufficient adaptation'. Instead it implicitly considers that general development reduces climate-induced diseases.",
10.1007/s10640-018-0262-8,Letta & Tol,2019,"Weather, Climate and Total Factor Productivity",found,10.1007/s10640-018-0262-8,AI,Step 5,60 countries,TFP growth; Economic growth; Welfare loss; Labour productivity; Savings Rate; Investment; Consumption per capita; GDP; Temperature shocks/impact.,"Temperature shocks, precipitation variability/changes, TFP (Total Factor Productivity) growth, emission abatement costs, weather shocks, climate change impacts.","The paper uses historical data from 1960–2006 without explicitly mentioning future socioeconomic or climate scenarios. It primarily relies on past climate data and econometric models to analyze the impact of climate on TFP growth. Although there's mention of projections of future warming (Page 19), specific technical scenario names for socioeconomic or climate pathways (like RCPs or SSPs) are not provided. Thus, the analysis seems mostly based on past observed data and not on particular future climate or socioeconomic scenarios.","The analysis uses panel regression models with country and Region x Time fixed effects to estimate the impact of temperature and precipitation changes on annual TFP growth (and labour productivity growth in some specifications). The primary data source is the Penn World Table (PWT 8.1), covering 60 countries from 1960-2006. The models incorporate interaction terms to explore non-linearities and heterogenous effects based on poverty, average temperature, GDP per capita, and institutional quality (Polity2). Various robustness checks are performed, including using different datasets, lag structures, and functional forms for weather variables. Standard errors are clustered at the country level, and Driscoll and Kraay standard errors are also used. First-differencing is employed to ensure stationarity. The analysis uses annual changes in temperature and precipitation levels. Temperature data are population-weighted. The DICE model is also used to explore climate change's effect on technological progress. Projections based on historical data are extrapolated to predict future warming's impact on TFP growth. The impact is assessed through semi-elasticity estimates and not long-run estimates.","Highlights: Temperature shocks negatively impact TFP growth, primarily in poor countries. This impact diminishes as income levels rise, becoming negligible above specific thresholds (approximately $14,900 - $34,400 depending on the country's classification as ""hot"" or ""not hot""). Climate change can reduce output, savings, and investment and permanently reduce future output possibilities through TFP effects. The negative impact is concentrated on TFP growth and labor productivity growth in poorer nations, with empirical evidence suggesting persistence of these impacts. While there's a correlation between temperature and TFP, causality isn't established, and the relationship appears non-linear.","The study investigates the impact of temperature on TFP growth, distinguishing between static and dynamic effects and highlighting the compounding effects of growth reductions. It links macro-level data (Penn World Table 8.1) with micro-level insights on temperature's impact on human physiology and labor productivity, especially in poorer countries. Potential measurement errors in TFP due to weather-related economic reallocations are acknowledged. Robustness checks reveal heterogeneous impacts based on climate, development levels, institutional quality (Polity2), and TFP composition, with income levels being a key moderator. Temperature's effect on TFP growth is found to be dependent on GDP per capita, institutional quality, and sectoral composition (e.g., agriculture). Using RCP 8.5 warming projections (2071-2095 vs. 1980-2004), the findings confirm that poorer countries will disproportionately suffer, although the estimated TFP reduction (5.30%) is considered an upper bound. The analysis uses interaction terms with GDP per capita and temperature categories to capture these heterogeneous effects. Limitations include a sample size of fewer than 70 countries and potential biases in TFP estimates due to measurement errors, model specification, adaptation investments, and the nature of TFP as a Solow residual. Weather shocks impact growth through TFP primarily when coupled with poverty.",Macroeconomic/Fiscal,Econometric,Acute shocks,Adaptive,,,Transitional (accounting for changes over time),,"The paper focuses on the impact of temperature shocks on TFP growth using historical data and econometric methods. Interactions between temperature changes and various factors like poverty, heat, GDP per capita, and institutional quality (Polity2) are examined. Different temperature bins are used to capture potential non-linearities. Future warming impacts on TFP growth are predicted using extrapolation.",,,,,,,,
10.1016/j.ecolecon.2021.107156,Olper A. et al.,2021,"Weather, climate and economic outcomes: Evidence from Italy",https://www3.nd.edu/~nmark/Climate/Weather--climate-and-economic-outcomes--Evidence-from_2021_Ecological-Econom.pdf,10.1016/j.ecolecon.2021.107156,AI,Step 5,,,,,,,,,,,,,,,,,,,,,,,,
