DOI,Author(s),Year,Paper Title,Link to paper,Paper ID,Reviewer,Status,Country(ies),Outcome(s) of Interest,Drivers of Risk,Scenario(s),Methodology,Highlights,More Notes,Applicability,Calibration Approach,Hazard definition,Impact persistence,Space disaggregation,Impact interactions,Economic dynamics,Climate features,Adaptation considered,Impacted Sector,Benefits of Adaptation,Costs of Adaptation,Ante/Post?,Planning Process,"""Soft Options""",Sufficiency Definition,Soft Options
10.1360/TB-2024-0439,Zhang S. et al.,2024,"Taking stock of climate action for a healthy and thriving future; [盘点气候风险机遇, 展望健康繁荣未来]",https://pure.iiasa.ac.at/id/eprint/20013/1/B41F001ECFA34CC2A9151067911B50C4-mark.pdf,10.1360/TB-2024-0439,AI,Step 5,China,Health; Prosperity; Mortality (Heat-related); Labor Productivity.,"Anthropogenic climate change; Sea level rise; Extreme weather events (heatwaves, droughts, floods, hurricanes); Increased frequency/severity; Heatwave mortality; Labor productivity loss; Drought impacts; Flood impacts.",Not specified in the provided notes.,"The study employs indicators across five domains (climate change impacts, adaptation, mitigation, economics and finance, and public and political engagement) to monitor health and climate change progress in China.","Anthropogenic climate change poses significant health and productivity risks, particularly affecting China's southern regions. Coastal populations face growing threats from sea level rise. Urban green spaces offer health benefits, while air pollution from coal remains an issue. In 2022, record-breaking heat and drought led to a 342% increase in heatwave-related mortality and a 24% rise in heat-related work loss.","The document likely synthesizes existing research on climate risks and adaptation, indicated by its title and collaborative authorship. It identifies a gap between public and professional awareness of climate-related health risks and notes the under-prioritization of health in climate action. It also mentions increasing coverage of climate risk early-warning systems. Policy recommendations emphasize renewable energy investment, air quality improvement synergies with carbon reduction, and meteorology-informed early warning systems to mitigate climate-related health risks.",Macroeconomic/Fiscal,,,,,,,,"Adaptation is included as one of five domains for tracking progress on health and climate change, using indicators related to China.",,,,,,,,
10.1088/1748-9326/ad0c88,Litzow M.A. et al.,2024,Climate attribution time series track the evolution of human influence on North Pacific sea surface temperature,https://michaelmalick-com-public.s3.us-west-2.amazonaws.com/papers/litzow_etal_2024.pdf,10.1088/1748-9326/ad0c88,AI,Step 5,,,,,,,,,,,,,,,,,,,,,,,,
10.1016/j.eneco.2023.106923,Colelli F.P. et al.,2023,Intensive and extensive margins of the peak load: Measuring adaptation with mixed frequency panel data,https://iris.unive.it/retrieve/167e4478-6dd9-44b0-982b-eafa0558350f/1-s2.0-S0140988323004218-main.pdf,10.1016/j.eneco.2023.106923,AI,Step 5,,,,,,,,,,,,,,,,,,,,,,,,
10.1371/journal.pone.0291577,Zhang Y. et al.,2023,"Agriculture, bioenergy, and water implications of constrained cereal trade and climate change impacts",https://journals.plos.org/plosone/article/file?type=printable&id=10.1371/journal.pone.0291577,10.1371/journal.pone.0291577,AI,Step 5,,,,,,,,,,,,,,,,,,,,,,,,
10.36956/rwae.v5i4.1186,Gold,2024,Food Insecurity in West Africa: Is Global Warming the Driver?,found,10.36956/rwae.v5i4.1186,AI,Step 5,,,,,,,,,,,,,,,,,,,,,,,,
10.1029/2023EF003556,Chaubey P.K. & Mall R.K.,2023,Intensification of Extreme Rainfall in Indian River Basin: Using Bias Corrected CMIP6 Climate Data,https://mceccr.in/document/2023/21.pdf,10.1029/2023EF003556,AI,Step 5,,,,,,,,,,,,,,,,,,,,,,,,
10.1016/j.gloenvcha.2023.102667,Park C.Y. et al.,2023,Impact of climate and socioeconomic changes on fire carbon emissions in the future: Sustainable economic development might decrease future emissions,Unknown,10.1016/j.gloenvcha.2023.102667,AI,Step 5,Unable to determine the country or group of countries based on the provided notes.,GDP per capita; Fire carbon emissions (CCE); Reduction; Fire management; Capitalized agriculture.,Climate change; socioeconomic changes; meteorology; biomass; land use; population density; GDP per capita; fire risk; fuel dryness; fuel load; fire suppression.,The paper does not mention specific technical scenario names for socioeconomic or climate scenarios within the provided notes.,"The methodology involves analysis over the 21st century, focusing on the impacts of meteorology, biomass, land use, population density, and GDP per capita. Decomposition analysis was conducted across nine scenarios to assess cumulative fire carbon emission changes from 2020 to 2099 compared to historical data, determining factor contributions to these changes. Original socioeconomic impact functions (CLMfse) were utilized to project future fire carbon emissions, and simulations explored emissions and fire spread under varying economic development scenarios, concentrating on future projections.","Economic growth (GDP per capita) is projected to significantly reduce future fire carbon emissions globally, particularly in African savannas, Southeast Asia, West Asia, and parts of South America, due to enhanced fire management and reduced fire frequency; however, increased fire disturbance could transform boreal forests into carbon sources.","Future fire carbon emissions are modeled as a function of meteorological factors, biomass, land use, population density, and GDP per capita under different SSP-RCP scenarios. Projections suggest that biomass contributions may be small or negative due to projected regional biomass decreases.",Macroeconomic/Fiscal,,Acute shocks,Adaptive,Global,,Transitional (accounting for changes over time),,"The analysis examines long-term changes in meteorology, biomass, land use, population density, and GDP per capita. Future fire C emissions are projected using socioeconomic impact functions under different economic development scenarios. Simulations explore fire emissions and impacts on fire spread, with analysis focused on future projections.",,,,,,,,
10.1007/s10584-023-03512-5,Stepanov I. et al.,2023,Climate change and challenges to sustainable development in the Russian Arctic,https://publications.hse.ru/pubs/share/direct/824846764.pdf,10.1007/s10584-023-03512-5,AI,Step 5,,,,,,,,,,,,,,,,,,,,,,,,
10.3389/fclim.2022.986088,Martínez-Zarzoso I. et al.,2023,"Climate change, natural disasters, and international migration: A country-level analysis considering climatic zones",https://core.ac.uk/download/pdf/570977024.pdf,10.3389/fclim.2022.986088,AI,Step 5,,,,,,,,,,,,,,,,,,,,,,,,
10.1016/j.crm.2023.100516,Tebaldi C. et al.,2023,The hazard components of representative key risks. The physical climate perspective,https://hal.science/hal-04191240/document,10.1016/j.crm.2023.100516,AI,Step 5,,,,,,,,,,,,,,,,,,,,,,,,
10.1007/978-3-031-15703-5_48,Webb P. et al.,2023,The Transition Steps Needed to Transform Our Food Systems,https://library.oapen.org/bitstream/id/368da814-9708-4f8b-b5f9-0c395104835f/978-3-031-15703-5.pdf,10.1007/978-3-031-15703-5_48,AI,Step 5,,,,,,,,,,,,,,,,,,,,,,,,
10.1016/j.ecolecon.2022.107627,Jarrett U. et al.,2023,Dry spells and global crop production: A multi-stressor and multi-timescale analysis,https://digitalcommons.unl.edu/cgi/viewcontent.cgi?article=1119&context=econfacpub,10.1016/j.ecolecon.2022.107627,AI,Step 5,The paper involves 118 countries but specifically excludes Sub-Saharan Africa due to data concerns.,"Crop production yields, aggregate crop production, per-capita value added in Agriculture, Forestry, Fishing, cereal yields, net crop production, FAO CPI, economic growth, GDP effects, drought effects, wheat yield loss, US maize and soybean production, macroeconomic outcomes, dry spells impact.","Dry spells, heat waves, drought, aridity, temperature shocks, water stress.","The study uses historical climate data (1979-2016) from the Climate Prediction Center (CPC) and analyzes outcomes under varying conditions of dry spells, heat waves, drought (SPEI), aridity, and irrigation. It also examines the effects of temperature shocks using evidence from the last half century, and employs distributed lag models to analyze temporal effects.","The study employs global panel data analysis from 1979-2016, focusing on dry spells, heat waves, and drought impacts on agricultural outcomes (FAO CPI growth rate, crop production, and GDP). Methodology includes:

*   **Data:** Climate Prediction Center (CPC) daily precipitation data gridded to 0.5 degrees latitude and longitude to calculate dry spell days. Data covers 118 countries (excluding Sub-Saharan Africa).
*   **Econometric Approach:** Primarily uses linear regression models with country and year fixed effects. Models also include distributed lag models (up to 5 years), split-sample regressions, and interaction terms. A sequential g-estimation is also employed.
*   **Key Variables:** Dry spell exposure anomalies, heat wave days, 12-month SPEI to identify water deficits and drought, annual precipitation, aridity index, lagged agricultural value added per capita.
*   **Controls/Adjustments:** Climate regimes, trends, droughts, potential effects of irrigation, water deficits, aridity, temperature bins, polynomial precipitation and temperature terms, linear and cubic country trends, lagged environmental variables and value added.
*   **Heterogeneity Analysis:** Subsample analysis and interaction terms are used to assess heterogeneous effects based on country-level aridity, drought (SPEI), and irrigation.
*   **Robustness:** Panel bootstrap with 1000 replicates for correlations, clustering standard errors at the country level.

The analysis isolates the effects of dry spells beyond overall rainfall, accounting for other stressors and considering multi-timescale impacts. The paper examines the persistence of dry spell effects using distributed lag models.","The analysis highlights the significant negative impacts of dry spells on crop production growth and food price indices, with effects compounded by droughts, aridity, and prolonged heatwaves. Dry spells particularly harm regions with water deficits (SPEI ≤ 0) and high aridity (Aridity Index ≤ 0.65). Irrigation can mitigate these effects. Heat waves alone also negatively impact growth in crop yields and FAO CPI, with a non-linear relationship between temperature and economic output. Although joint exposure to dry spells and heatwaves shows variable negative impacts, longer heatwave durations exacerbate the damage. The adverse effects of dry spells persist and are statistically significant, particularly in agricultural sectors. Overall, water stress from climate events such as dry spells and heatwaves presents notable macroeconomic and macro-fiscal risks, underscoring the need for adaptation measures at national levels.","The study investigates the impact of dry spells and heat waves on crop production, employing panel data analysis leveraging both between- and within-country variation. It uses dry spell days of varying lengths (7-35 days) and controls for temperature, precipitation (both linear and quadratic terms), and country-specific time trends. Production consequences are isolated using fixed international prices to weight crop production. The analysis explores irrigation as a moderator of dry spell effects and addresses potential endogeneity concerns regarding drought using sequential g-estimation. The interaction of dry spells and heat waves (both simultaneous and co-located) is examined, with robustness checks conducted using different model specifications. The impact heterogeneity based on heat wave exposure (varying duration) is also explored. Variables representing temperature, temperature squared, precipitation, and precipitation squared are used as controls. Results suggest that irrigation may facilitate adaptation to dry spells. While some results might be sensitive to model specification, the core findings on the impact of dry spells are generally consistent.",Macroeconomic/Fiscal,Econometric,Acute shocks,Adaptive,Global,Sequential Interactions,Transitional (accounting for changes over time),,"The analysis accounts for irrigation by modifying specifications to mitigate its effects on crop choice and productivity. It also examines subsamples varying with background water stress, explores interactions with drought and aridity, and tests for the effect of irrigation. Some models incorporate country-specific fixed effects, time trends, precipitation, and temperature, while others use split-sample regressions and interaction terms to examine heterogeneity based on aridity and drought, effectively isolating dry spell effects from overall rainfall.",,,,,,,,
10.1080/00036846.2022.2107165,Abou-Ali H. et al.,2023,Is it getting too hot to work? Investigating the impact of climate change on labour supply in the MENA region,https://erf.org.eg/app/uploads/2021/12/1640260442_238_3955335_1515.pdf,10.1080/00036846.2022.2107165,AI,Step 5,,,,,,,,,,,,,,,,,,,,,,,,
10.1057/s41599-022-01130-7,Sarkodie S.A. et al.,2022,Global adaptation readiness and income mitigate sectoral climate change vulnerabilities,https://nordopen.nord.no/nord-xmlui/bitstream/handle/11250/2999578/Sarkodie.pdf?sequence=4,10.1057/s41599-022-01130-7,AI,Step 5,192 countries and territories,"Sectoral climate vulnerabilities, ecosystem services, food, health, human habitat, infrastructure, water, climate change vulnerability scores, governance readiness, corruption, political instability, climate change adaptation, environmental sustainability, vulnerability reduction, natural resources prioritization, adaptive actions, vulnerability exposure, sensitivity, adaptation assessment.","Emissions (levels, stocks, anthropogenic GHG), Climate change impacts (exposure, sensitivity, adaptability, vulnerability - sectoral, extreme), Income (level, reduced), Economic readiness (low), Governance readiness (poor), Resources (limited), Developing countries, Social.",No technical scenario names are mentioned in the provided notes.,"Methodology includes Romano–Wolf estimation for heterogeneous effects and to test multiple hypotheses regarding climate vulnerability and readiness across 192 countries. Panel data analysis is used to assess causal relationships, incorporating country-level data categorized by quantiles. A cross-section dependence test is employed to account for global common shocks and spillover effects. Empirical evidence is used to assess vulnerability reduction.","High-income countries generally exhibit low climate vulnerability due to strong social, governance, and economic readiness, while developing economies, particularly in Sub-Saharan Africa, Southern/Eastern/South-East Asia, face high climate change exposure and sensitivity. Improvements in economic, governance, and especially social readiness, alongside rising incomes, mitigate sectoral climate vulnerability and reduce the long-term costs of environmental damage, offering policymakers insights for resilient development planning and implementation.","This research analyzes the long-term effects of climate change readiness and income growth on sectoral climate vulnerabilities, providing a geographical distribution of these vulnerabilities across countries. It examines climate change readiness as an investment in abatement technologies and sustainable options, and models both non-cooperative and dynamic game scenarios. The climate reduction effect of readiness and income is most pronounced in health services, followed by food, habitat, ecosystem services, infrastructure, and water.",Adaptation,,,,,,,,,The provided notes do not contain information about specific economic sectors impacted by climate change.,"The benefits of adaptation are quantified through empirical assessments that often utilize panel data analysis across multiple countries to determine causal effect relationships. Techniques like the Romano–Wolf estimation are used to account for heterogeneous effects, while cross-section dependence tests assess global common shocks. This methodology helps identify the strength and weaknesses in reducing vulnerability to climate change at a national level.","This paper focuses on assessing climate vulnerability and readiness using the Romano-Wolf technique and panel data analysis across 192 countries. It doesn't directly explain how adaptation costs are quantified. Instead, it emphasizes empirical assessment of vulnerability reduction and identifying causal relationships.","The analysis relies on ex-post observations, using empirical assessment based on panel data analysis of 192 countries.","The paper focuses on empirically assessing climate vulnerability and readiness using a Romano-Wolf technique and panel data analysis across 192 countries, aiming to understand the spatial-temporal severity of climate vulnerability and readiness, causal relationships, and the effectiveness of vulnerability reduction efforts. It employs statistical methods to account for heterogeneity and global spillover effects. There is no explicit discussion of the adaptation planning/decision-making *process* itself, but rather an assessment of vulnerability and readiness, which can inform such a process.",,"The provided notes do not explicitly define ""sufficient adaptation levels"" or ""well-adapted."" However, the paper assesses vulnerability and readiness using a spatial-temporal approach, potentially implying that ""well-adapted"" is achieved when vulnerability is reduced and readiness is strong. The empirical evidence is used to determine the effectiveness of vulnerability reduction strategies across 192 countries. The Romano-Wolf technique accounts for heterogeneous effects across countries.","Cannot answer based on the provided information. The excerpts detail the methodological approach of a vulnerability study but do not provide information about the benefits of ""soft options"" or institutional interventions."
10.21919/remef.v17i4.794,Lucatello S. & Sánchez R.,2022,"Climate Change in North America: Risks, Impacts, and Adaptation. A Reflection Based on the IPCC Report AR6 – 2022; [Cambio climático en América del Norte: riesgos, impactos y adaptación. Una reflexión basada en el Informe AR6 del IPCC – 2022]",https://www.redalyc.org/journal/4237/423780639002/423780639002.pdf,10.21919/remef.v17i4.794,AI,Step 5,,,,,,,,,,,,,,,,,,,,,,,,
10.1007/s00148-022-00924-y,Helbling & Meierrieks,2023,Global warming and urbanization,https://www.econstor.eu/bitstream/10419/265120/1/Full-text-article-Helbling-et-al-Global-warming-and.pdf,10.1007/s00148-022-00924-y,AI,Step 5,118 countries were considered.,"Agricultural productivity; Urbanization (levels, rate, migration); Economic growth & development (via urbanization); Public goods (rural vs. urban); Temperature changes impact.","Global warming (increasing temperatures), urbanization, economic downturns, adverse initial conditions (lower adaptive capacity, higher vulnerability), other weather/climate phenomena (heat waves, droughts, floods), initial GDP, initial employment in agriculture, initial urban bias, cluster (poor conditions).",No specific socioeconomic or climate scenarios are mentioned in the notes extracted from the paper.,"The methodology employs panel vector error correction models, country-level panel data analysis from a 118-country sample (1960-2016), and a push-pull framework of internal migration. It links temperature to urbanization rates and formulates hypotheses on their relationship. The dataset requires a fully balanced structure and averages weather data to correct for grid and elevation disparities. Cross-sectional dependence is assessed using Pesaran et al. (2008) and Pesaran (2015) tests. Unit root tests by Pesaran (2007), Herwartz and Siedenburg (2008), and Demetrescu and Hanck (2012) assess urbanization and temperature data, robust against cross-sectional dependence, serial correlation, and heteroskedasticity. Fixed effects regression models with Driscoll-Kraay standard errors employ various controls and interactions for time and regional fixed effects. Dynamic fixed-effects and OLS estimations analyze short-run and long-run impacts with controls like GDP p.c., population size, democracy, and education. Cointegration analysis addresses omitted variable bias using Oster's (2019) method. Robustness checks include additional controls, alternative variable measures, and lagged variables. K-means cluster analysis groups countries by initial conditions, followed by panel vector error correction models to explore interactions between variables. Dynamic panel-data analysis via a 2-step GMM system estimator incorporates fixed effects and multiple controls, with robustness checks involving agro-climatic variables.","Higher temperatures correlate with and are linked to increased urbanization, particularly in the long run, especially in poorer, agriculture-dependent countries with an urban bias. This relationship is stronger in the long run than the short run, with some evidence suggesting a short-term negative association. Initial conditions like temperature, urbanization, GDP per capita, agricultural employment, and urban bias significantly influence urbanization trends. Temperature and urbanization data exhibit statistical properties requiring specific econometric techniques. Rapid urbanization and global warming are concurrent trends. Reducing greenhouse gas emissions and mitigating rural vulnerabilities to global warming are crucial to manage the potentially dangerous consequences of climate-induced urbanization.","The study investigates the relationship between global warming and urbanization, particularly focusing on agriculture and public goods provision as mediating channels. Warming contributes to agricultural productivity losses and pro-urban shifts in public goods provision, driving rural-urban migration, especially in countries with economic and institutional underdevelopment and strong agricultural dependence. However, temperature increases can also disincentivize migration by raising costs and worsening liquidity constraints, with long-run effects potentially being more pronounced. The analysis uses econometric methods to account for cross-sectional dependence, non-stationarity, and cointegration, employing various measures of temperature and urbanization for robustness. The effects are moderated by urbanization, initial conditions (poverty), and the mediators of value added in agriculture and public goods provision equity. The relationship between warming and urbanization is particularly strong in poorer economies lacking adaptive capacity. The study period is 1960-2016, excluding small island nations, newly independent countries, and city-states.",Macroeconomic/Fiscal,Econometric,Chronic trends,Permanent,Global,Spatial Interactions,Transitional (accounting for changes over time),,"The study focuses on the relationship between temperature increases and urbanization. It uses econometric methods like panel data analysis, fixed effects regressions, and GMM estimation. These methods control for various factors, including socio-economic and political variables. The analysis examines both short-run and long-run impacts and addresses potential biases and robustness. The research groups countries by initial conditions, including temperature and economic development, to analyze urbanization changes.",,,,,,,,
10.3389/fclim.2022.931514,Grossi A. & Dinku T.,2022,From research to practice: Adapting agriculture to climate today for tomorrow in Ethiopia,https://core.ac.uk/download/pdf/595406999.pdf,10.3389/fclim.2022.931514,AI,Step 5,,,,,,,,,,,,,,,,,,,,,,,,
10.5194/nhess-22-2567-2022,Chan F.K.S. et al.,2022,"Comparison of sustainable flood risk management by four countries - the United Kingdom, the Netherlands, the United States, and Japan - and the implications for Asian coastal megacities",https://nhess.copernicus.org/articles/22/2567/2022/nhess-22-2567-2022.pdf,10.5194/nhess-22-2567-2022,AI,Step 5,,,,,,,,,,,,,,,,,,,,,,,,
10.1007/s11356-022-19672-3,Que N.D. et al.,2022,How temperature shocks impact energy poverty in Vietnam: mediating role of financial development and environmental consideration,https://file.vnua.edu.vn/data/13/documents/2022/03/29/adminktptnt/2022-how-temperature-shocks-impact-energy-poverty-in-vietnam-mediating-role-of-fnancial-development-and-environmental-consideration.pdf,10.1007/s11356-022-19672-3,AI,Step 5,,,,,,,,,,,,,,,,,,,,,,,,
