DOI,Author(s),Year,Paper Title,Link to paper,Paper ID,Reviewer,Status,Country(ies),Outcome(s) of Interest,Drivers of Risk,Scenario(s),Methodology,Highlights,More Notes,Applicability,Calibration Approach,Hazard definition,Impact persistence,Space disaggregation,Impact interactions,Economic dynamics,Climate features,Adaptation considered,Impacted Sector,Benefits of Adaptation,Costs of Adaptation,Ante/Post?,Planning Process,"""Soft Options""",Sufficiency Definition,Soft Options
10.1126/science.aab3574,Tessler Z.D. et al.,2015,Profiling risk and sustainability in coastal deltas of the world,https://efi.eng.uci.edu/papers/efg_166.pdf,10.1126/science.aab3574,AI,Step 5,Insufficient information to determine the specific country or group of countries considered. The notes describe the methodology but do not mention any specific locations.,Flood risk; investment sustainability; risk reduction costs/benefits; vulnerability; GDP; economic development.,Climate change impacts; Local human activities; Land subsidence; Water management; Sea-level rise; Climate extremes; Population growth; Urbanization; Economic development; Infrastructure investment; Energy prices; Interest rates; Sediment transport; Hazardous event exposure.,"Increased energy prices, anthropogenic and geophysical considerations, geophysical hazards, anthropogenic change.","Risk is modeled via scenario analysis using projections of energy price growth (100-year) and IDI scores; incorporating uncompensated risk (anthropogenic and geophysical factors) alongside vulnerability estimates. A risk-trend analysis approach is used, examining contemporary risk and future risk-trend growth, accounting for geophysical hazards, anthropogenic change, and investment capacity.","Wealthy nations currently mitigate flood risk through infrastructure investments tied to GDP, but this may become unsustainable. Wealthy deltas have seen significant vulnerability reduction through infrastructure, while poorer deltas remain more vulnerable and sensitive to hazardous events. Economic capacity and engineering solutions are critical for risk management.","The Ganges-Brahmaputra delta exhibits the highest rate of change in risk for its population and the highest risk per capita among major deltas, though other deltas also face significant impacts. A low Investment Deficiency Index (IDI) suggests a strong capacity for investing in risk-reducing technologies. However, if future scenarios limit this investment capacity, high-GDP deltas' risk levels may realign with expectations based solely on geophysical and anthropogenic factors.",Adaptation,,,,,,,,,Energy.,"Benefits of adaptation are quantified by modeling scenarios that incorporate factors like increased energy prices and adjusting vulnerability scores based on future projections. The analysis considers geophysical hazards, anthropogenic change, and investment capacity through a risk-trend analysis examining contemporary and future risk.","Adaptation costs are quantified by modeling scenarios, such as those with increased energy prices, and adjusting indicators based on long-term projections. This involves analyzing both contemporary and future risk, considering geophysical hazards, anthropogenic change, and investment capacity.","The analysis relies on ex-ante modeling, using projections and future risk-trend growth analysis.","The paper discusses incorporating future risk into adaptation planning/decision-making by modeling scenarios with increased energy prices, adjusting existing indices based on future projections, and utilizing a risk-trend analysis considering geophysical hazards, anthropogenic change, and investment capacity.",The provided excerpts do not contain information to determine the benefit of soft adaptation options.,"Based on these excerpts, the paper seems to define sufficient adaptation in terms of mitigating future risk increases driven by a combination of geophysical hazards, anthropogenic change (specifically energy prices exceeding GDP growth), and considering current vulnerability and investment capacity. ""Well-adapted"" would likely mean achieving a level where the adjusted risk score (IDI) and the future risk-trend growth are minimized, factoring in both the inherent geophysical risks and the capacity to respond.",
10.1007/s10584-020-02940-x,Clay et al.,2020,Ocean and coastal indicators: understanding and coping with climate change at the land-sea interface,https://repository.library.noaa.gov/view/noaa/50504/noaa_50504_DS1.pdf,10.1007/s10584-020-02940-x,AI,Step 5,,,,,,,,,,,,,,,,,,,,,,,,
10.1016/j.worlddev.2015.03.003,Lohmann & Lechtenfeld,2015,The Effect of Drought on Health Outcomes and Health Expenditures in Rural Vietnam,https://www.econstor.eu/bitstream/10419/100099/1/787337579.pdf,10.1016/j.worlddev.2015.03.003,AI,Step 5,,,,,,,,,,,,,,,,,,,,,,,,
10.5194/hess-20-4143-2016,Hanasaki et al.,2016,A seawater desalination scheme for global hydrological models,https://hess.copernicus.org/articles/20/4143/2016/hess-20-4143-2016.pdf,10.5194/hess-20-4143-2016,AI,Step 5,Global domain (all countries).,GDP impacts of climate change; global desalination costs; water scarcity economics; energy demand and costs of desalination.,"Climate change, water demand, socioeconomic factors (SSP scenarios, population, GDP, income growth), aridity, limited water sources, desalination costs.",The outcomes were analyzed under socioeconomic scenarios using the Shared Socioeconomic Pathways (SSPs) and climate projections from the MIROC4-ESM-CHEM global climate model.,"The study employs a model designed for integration with global hydrological models to estimate seawater desalination usage and production for historical and future periods. It utilizes long-term global water scarcity projections, considering data from major desalination plants, socioeconomic pathways (SSPs) for population and GDP, historical water usage, and climate projections from MIROC4-ESM-CHEM. The Seawater Desalination Model (SDM and SDM2) simulates desalination capacity, validated against AQUASTAT and MDPS data, focusing on geographical coverage, total production, and temporal changes. Future desalination is projected using a Spatial Dynamic Model (SDM) with SSP scenarios, evaluating economic costs per production unit based on 186 global plants and considering GDP and aridity. Two models identify climatic and socioeconomic conditions for current usage and project future global desalination production under varying socioeconomic scenarios.","Seawater desalination is expected to expand significantly, driven by increased water demand due to climate change and income growth, especially in arid regions. It is a practical measure for addressing water scarcity and adapting to climate change. The production of desalinated water is projected to rise, with notable economic impacts, particularly in the MENA region where it may represent 0.032–0.306% of regional GDP. The SDM model effectively captures global desalination volumes but faces limitations due to data scarcity and model simplicity. Under SSP3 scenarios, the highest desalination volumes are projected due to heightened water demand.","Socioeconomic scenarios (SSP1, SSP2, SSP3) significantly impact projections of climate change effects. A study focusing on large desalination plants (81% of capacity) acknowledges data limitations and potential discrepancies, especially in regions like MENA, with technological advancements (e.g., CSP desalination) adding further uncertainty.",Macroeconomic/Fiscal,Stylised,Chronic trends,Adaptive,Regional,Spatial Interactions,Transitional (accounting for changes over time),,"Adaptation is incorporated via a seawater desalination model (SDM and SDM2) used to simulate and project desalination capacity and production based on socioeconomic pathways (SSPs) and climate projections. The model considers aridity, distance to plants and cities, and economic costs, analyzing desalination production at national and subnational levels. The extent is global and long-term, focusing on water scarcity.",,,,,,,,
10.1016/j.worlddev.2021.105793,Eskander & Barbier,2022,Long-term impacts of the 1970 cyclone in Bangladesh,http://eprints.lse.ac.uk/113475/1/EskanderBarbier2021_WD_AAM2.pdf,10.1016/j.worlddev.2021.105793,AI,Step 5,,,,,,,,,,,,,,,,,,,,,,,,
10.1016/j.glt.2023.07.001,Zhang et al.,2023,The impact of fossil fuel combustion on children's health and the associated losses of human capital,https://www.newswise.com/pdf_docs/169400129996396_1-s2.0-S2589791823000154-main.pdf,10.1016/j.glt.2023.07.001,AI,Step 5,,,,,,,,,,,,,,,,,,,,,,,,
10.1111/plb.13469,George et al.,2022,Long-term forest monitoring reveals constant mortality rise in European forests,https://paulbuerkner.com/publications/pdf/2022__George_et_al__Plant_Biology.pdf,10.1111/plb.13469,AI,Step 5,,,,,,,,,,,,,,,,,,,,,,,,
10.1002/fes3.70046,Devkota et al.,2025,A Blueprint for Building Resilience and Food Security in MENA and SSA Drylands: Diversifying Agriculture With Neglected and Underutilized Species,https://researchonline.lshtm.ac.uk/id/eprint/4674951/1/Devkota-etal-2020-A-Blueprint-for-Building-Resilience-and-Food-Security-in-MENA-and-SSA-Drylands-Diversifying-Agriculture-With-Neglected-and-Underutilized-Species.pdf,10.1002/fes3.70046,AI,Step 5,,,,,,,,,,,,,,,,,,,,,,,,
10.1093/epolic/eiab008,Kotlikoff et al.,2021,Pareto-improving carbon-risk taxation,https://www.nber.org/system/files/working_papers/w26919/w26919.pdf,10.1093/epolic/eiab008,AI,Step 5,"The provided notes do not explicitly mention any specific country or group of countries. The model is theoretical and uses calibrated parameters, but doesn't apply to a particular nation.","Aggregate consumption, output (GDP) decline, total factor productivity (TFP), welfare (utility) gains/losses (present and future generations, consumption equivalence), climate disaster probability, damages (% of output/GDP), temperature changes.","Climate shocks, dirty energy usage shocks, CO2 emissions uncertainty, CO2-temperature sensitivity uncertainty, damage function shocks (including tipping points), equilibrium climate sensitivity (ECS) uncertainty, stochastic damage function, temperature shocks.","Deterministic (no uncertainty), Stochastic, Business as Usual (BAU) equilibrium, Random Walks.","The analyses predominantly employ overlapping generations (OLG) models, often stochastic and occasionally dynamic stochastic general equilibrium (DSGE) or dynamic general equilibrium models with heterogeneous agents. These models incorporate climate risk shocks (dirty energy share, climate sensitivity, tipping points) and analyze optimal carbon tax policies and revenue redistribution. Methodologies include projection methods and implementations following Krusell and Smith (1998) and Kubler and Scheidegger (2019). Models often assume initial deterministic economies disrupted by the discovery of climate change. Key features include production functions with technological progress, temperature equations and damage functions (sometimes based on Weitzman (2012) or Golosov et al. (2014)), and stochastic elements in climate parameters modeled as random walks. Simulations analyze the distributions of TFP-damages, temperature changes, and aggregate consumption losses under various policies and time horizons, often comparing results to 'Business as Usual' (BAU) scenarios or deterministic models. Numerical examples use shocks (energy usage, temperature, and carbon cycle) to model climate change effects.","Carbon taxation, particularly when designed to address climate risk and disasters (climate-risk tax), can significantly reduce climate risk and improve welfare, especially for future generations, by limiting average damage and the probability of crossing climate tipping points (around a 3-degree Celsius temperature increase). Uncertainty in CO2 emissions and the persistence of dirty energy use amplify long-run damages and disaster probabilities, highlighting the need for policies that promote a transition to clean energy. CO2-dependent carbon taxes are more effective than fixed taxes in mitigating climate risk, even though constant tax rates (e.g., 20-35%) can offer welfare gains and reduce disaster probability. Optimal tax policies involve revenue redistribution to ensure no generation experiences a loss in expected utility, prioritizing Pareto improvements that minimize disaster risk over uniform welfare gains. Increasing carbon taxes over time, especially in response to rising CO2 concentrations, further reduces disaster risks, though uncertainty in the damage function remains a crucial factor influencing outcomes. In the absence of climate-related risk, the need for policy interventions is minimal.","The model focuses on carbon risk as a driver of downside climate risk, exploring optimal carbon taxation in a multi-generational context. It features energy-usage shocks as a prerequisite for climate disasters, with climate sensitivity modeled as a random walk. A 'carbon-risk tax' is introduced, potentially exceeding the tax needed for average damage. The model includes dirty energy production, carbon taxation with revenue redistribution, and overlapping generations, with the distribution of assets condensed into a single state variable. The model simplifies by ignoring secular growth and acknowledging that the energy-usage shock formulation lacks micro-foundations. TFP-damages are used as a measure of economic damage. Higher carbon taxes could mitigate climate change but might require intergenerational compensation. The model acknowledges uncertainties in equilibrium climate sensitivity, using a simplistic climate model with a conservative calibration, suggesting that actual disasters are likely greater than predicted. Carbon taxes and redistribution end when the economy switches entirely to green energy. High carbon taxes at critical CO2 concentration levels might lead to consumption disasters. The authors argue their conservative parameter choices and stochastic approach provide lower bounds on possible damages and improved carbon taxes.",Macroeconomic/Fiscal,,Stylised changes,Adaptive,,Sequential Interactions,Adaptive (reflecting shifts in economic behavior in response to impacts),Tipping Points,"Models often involve optimizing carbon taxes or other policies. Some studies analyze the effects of different carbon tax policies under various shocks. Policy instruments include taxes on dirty energy and revenue redistribution among generations. Scenarios with and without carbon taxation are simulated. The analysis examines the distribution of TFP-damages, temperature changes, and aggregate consumption losses. Some models aim for Pareto-improvements and focus on maintaining current generations' utility.",,,,,,,,
10.5194/esd-13-251-2022,Rutgersson et al.,2022,Natural hazards and extreme events in the Baltic Sea region,https://esd.copernicus.org/articles/13/251/2022/esd-13-251-2022.pdf,10.5194/esd-13-251-2022,AI,Step 5,,,,,,,,,,,,,,,,,,,,,,,,
10.1029/2022EF002936,He L. et al.,2022,Marked Impacts of Pollution Mitigation on Crop Yields in China,https://weijing-rs.github.io/publications/He_et_al-EF-2022.pdf,10.1029/2022EF002936,AI,Step 5,,,,,,,,,,,,,,,,,,,,,,,,
10.3389/fenvs.2022.941490,Hegglin M.I. et al.,2022,Space-based Earth observation in support of the UNFCCC Paris Agreement,https://juser.fz-juelich.de/record/910338/files/fenvs-10-941490.pdf,10.3389/fenvs.2022.941490,AI,Step 5,,,,,,,,,,,,,,,,,,,,,,,,
10.1038/s43017-020-0085-3,Bowman D.M.J.S. et al.,2020,Vegetation fires in the Anthropocene,https://escholarship.org/content/qt2wp608ww/qt2wp608ww_noSplash_1f53361fb0037bc983833478a6e12e7d.pdf,10.1038/s43017-020-0085-3,AI,Step 5,,,,,,,,,,,,,,,,,,,,,,,,
10.1038/s41586-020-2035-0,Hubau W. et al.,2020,Asynchronous carbon sink saturation in African and Amazonian tropical forests,https://core.ac.uk/download/pdf/619574149.pdf,10.1038/s41586-020-2035-0,AI,Step 5,,,,,,,,,,,,,,,,,,,,,,,,
10.1371/journal.pone.0179632,Blasiak R. et al.,2017,Climate change and marine fisheries: Least developed countries top global index of vulnerability,https://core.ac.uk/download/pdf/303786681.pdf,10.1371/journal.pone.0179632,AI,Step 5,,,,,,,,,,,,,,,,,,,,,,,,
10.1038/nclimate2837,Huang J. et al.,2016,Accelerated dryland expansion under climate change,https://hjp.lzu.edu.cn/upload/news/N20180925142954.pdf,10.1038/nclimate2837,AI,Step 5,,,,,,,,,,,,,,,,,,,,,,,,
10.17323/1995-459X.2015.4.6.17,Apokin A. et al.,2015,Long-term socioeconomic challenges for Russia and demand for new technology,http://www.forecast.ru/_ARCHIVE/Analitics/Forsight/1-Belousov-6-17.pdf,10.17323/1995-459X.2015.4.6.17,AI,Step 5,,,,,,,,,,,,,,,,,,,,,,,,
10.1007/s10584-011-0042-8,Cheng H. & Hu Y.,2012,Improving China's water resources management for better adaptation to climate change,https://research.fit.edu/media/site-specific/researchfitedu/coast-climate-adaptation-library/asia-amp-indian-ocean/china/Cheng--Hu.--2012.--China-Water-Resource-Management--CC.pdf,10.1007/s10584-011-0042-8,AI,Step 5,China,"Water scarcity, agriculture, China; water use efficiency; rainwater harvesting; economic enhancement; water resources management; water pollution; climate change impacts; water demand.","Water scarcity, under-pricing, rapid economic growth, urbanization, decreased precipitation, landscape change, temperature rise, runoff sensitivity, water availability impacts, non-agricultural water demand, socio-economic development, low water use efficiency, excessive water abstraction, pollution, ecosystem damage, natural water shortage, freshwater stress, water demand increase.",Climate change and socio-economic scenarios (unspecified).,"Methodology includes analysis of water use and rainwater harvesting (2001-2007, focus on 2004/2006), comparison of water resource indicators (precipitation, surface water, total water) in major river basins across two time periods (1956-1979 vs. 1980-2000), and modeling integration of climate change and socioeconomic scenarios to assess impacts on agricultural water availability in China.","China faces significant water resource challenges due to shortages, pollution, and climate change, particularly in northern regions where water resources have significantly decreased. Amendments to water law emphasize sustainable management. Rainwater harvesting and water use efficiency offer economic benefits in water-scarce regions. Environmental restoration reduces pollution and freshwater abstraction needs. Socio-economic development has a larger impact on agricultural water availability than climate change. Demand management and pollution control are crucial for water adaptation strategies. Runoff increased in Southern China.","China's water resource management is evolving from infrastructure-heavy, supply-side approaches to more comprehensive management incorporating demand-side strategies, pollution control, and ecological considerations. While China has been actively addressing climate change impacts on water resources, traditional water allocation practices exacerbate drought impacts. Vulnerability to climate change varies across river basins, with southern regions like the Yangtze River basin being relatively less vulnerable.",Adaptation,,,,,,,,,"Agriculture, specifically agricultural water availability, is a sector impacted.","Based on the provided text, the benefits of adaptation are quantified, in the context of agricultural water availability in China, through integrated models using climate change and socio-economic scenarios. These models analyze precipitation, surface water resources, and total water resources over different time periods to assess the potential impacts of climate change and socio-economic development. Furthermore, water use and rainwater harvesting practices can be reviewed, to determine the potential for expansion.","Based on the provided notes, the quantification of adaptation costs is not explicitly detailed. However, the document hints at using data on current water use, rainwater harvesting, changes in water resource availability (surface water, precipitation), and integrated climate change and socio-economic models to assess the impacts of climate change on agricultural water availability. These assessments could then inform the potential costs of adaptation measures in the water sector.","The analysis relies on both ex-post observations and ex-ante modeling. Historical data analysis (1956-2007) constitutes ex-post observation, while the use of climate change and socio-economic scenarios to study potential impacts represents ex-ante modeling.","The notes provided do not directly discuss the adaptation planning or decision-making process. The notes primarily detail water resource analyses, climate change models related to agricultural water availability, and comparisons of water resources over different periods. Understanding or planning adaptation based on these analyses might be implicit, but specific adaptation planning or decision-making processes are not explicitly mentioned.","The provided text excerpts do not offer information about the benefits of ""soft options"" for climate change adaptation.","This paper focuses on water resource adaptation in China, assessing changes in water availability under different climate change and socio-economic scenarios. While it doesn't explicitly define ""sufficient adaptation,"" it implies that being well-adapted means maintaining adequate agricultural water availability despite climate change impacts. The analysis seems to compare past and present water resource availability and model future scenarios to assess potential adaptation needs.",
10.17323/1995-459X.2015.4.6.17,Apokin et al.,2015,Long-term Socioeconomic Challenges for Russia and Demand for New Technology,http://www.forecast.ru/_ARCHIVE/Analitics/Forsight/1-Belousov-6-17.pdf,10.17323/1995-459X.2015.4.6.17,AI,Step 5,,,,,,,,,,,,,,,,,,,,,,,,
10.1017/S1355770X23000037,Chen et al.,2023,Does extreme temperature exposure take a toll on mental health? Evidence from the China Health and Retirement Longitudinal Study,https://repec.iza.org/dp16092.pdf,10.1017/S1355770X23000037,AI,Step 5,,,,,,,,,,,,,,,,,,,,,,,,
10.1038/NCLIMATE2837,Huang et al.,2016,Accelerated dryland expansion under climate change,https://hjp.lzu.edu.cn/upload/news/N20180925142954.pdf,10.1038/NCLIMATE2837,AI,Step 5,,,,,,,,,,,,,,,,,,,,,,,,
10.1007/s11027-011-9295-9,Lal et al.,2011,Socio-economic impacts of climate change on rural United States,https://www.srs.fs.usda.gov/pubs/ja/2011/ja_2011_lal_002.pdf,10.1007/s11027-011-9295-9,AI,Step 5,U.S.,"Agricultural impacts, unemployment, rural earnings, forestry losses, rural job creation, rural economy, quality of life, investment.",Climate change impacts; regional variations; rural communities; agriculture; skills/education; invasive species; temperature/precipitation changes; wildfires; water stress; resource availability.,IPCC scenarios.,"Review assesses vulnerability of rural U.S. communities to climate change using IPCC scenarios. Employs a regional case study approach at national, regional, and local scales to enhance stakeholder involvement.","Rural U.S. populations, particularly in farming communities and the Southwest, face disproportionate vulnerability to climate change impacts including agricultural losses, water stress, increased production costs (weed control, livestock), and wildfire risks leading to reduced forest productivity and higher suppression costs. Rural areas, already facing income gaps with urban centers, may benefit from ecosystem service markets, regional planning, and cellulosic energy development for job creation and economic improvement.","Climate change impacts will vary geographically, with rural Southeast regions facing heightened vulnerability due to high unemployment and lower coping capacities. Monetizing environmental stewardship and expanding renewable energy use in rural areas could increase investment and lessen vulnerability. The focus is on agriculture and recreation/tourism in the US, but lacks original quantitative analysis.",Adaptation,,,,,,,,,"Yes, the agricultural sector (specifically rural U.S. communities) is identified as being impacted.","The provided notes don't directly address how adaptation benefits are quantified. They focus on vulnerability assessment, spatial scales of analysis, and stakeholder engagement, but not on the methods for quantifying adaptation benefits themselves.","Adaptation costs are quantified through regional case studies at different spatial scales (national, regional, and local) to incorporate stakeholder involvement.","The analysis primarily relies on ex-ante modeling using IPCC scenarios, supplemented by regional case studies.","The adaptation planning/decision-making process, as suggested by the provided notes, involves stakeholder involvement, and employs a regional case study approach at different spatial scales (national, regional, and local) to make stakeholder engagement more productive. The overall aim is to assess the vulnerability of communities to climate change, informed by IPCC scenarios.","Enabling more productive stakeholder involvement in the assessment process through regional case studies at different spatial scales (national, regional, and local).","This paper does not explicitly define ""sufficient adaptation levels"" or what it means to be ""well-adapted."" It focuses on assessing vulnerability to climate change in rural U.S. communities using IPCC scenarios and employs a regional case study approach to involve stakeholders in the assessment process. The paper seems to be about assessing vulnerability rather than defining adaptation success.",
10.2307/2845973,Joyce et al.,1995,Forest sector impacts from changes in forest productivity under climate change,https://www.fs.usda.gov/rm/pubs_other/rmrs_2007_joyce_l001.pdf,10.2307/2845973,AI,Step 5,,,,,,,,,,,,,,,,,,,,,,,,
