DOI,Author(s),Year,Paper Title,Link to paper,Paper ID,Reviewer,Status,Country(ies),Outcome(s) of Interest,Drivers of Risk,Scenario(s),Methodology,Highlights,More Notes,Applicability,Calibration Approach,Hazard definition,Impact persistence,Space disaggregation,Impact interactions,Economic dynamics,Climate features,Adaptation considered,Impacted Sector,Benefits of Adaptation,Costs of Adaptation,Ante/Post?,Planning Process,"""Soft Options""",Sufficiency Definition,Soft Options
10.1007/978-3-030-05252-2_7,Groves D.G. et al.,2019,Robust Decision Making (RDM): Application to Water Planning and Climate Policy,https://library.oapen.org/bitstream/handle/20.500.12657/22900/1/1007261.pdf#page=143,10.1007/978-3-030-05252-2_7,AI,Step 5,"The Netherlands, Colorado River Basin (USA).","pvGDP, GDP regret, GHG emissions, economic risks (river navigation), adaptation costs/benefits/co-benefits, ENPV, failure probability, robustness, consumer welfare, utility function, policy success (temperature targets, decarbonization), flood damage/protection costs, adaptation option cost-effectiveness/community preferences, NPV, value of flexibility, lifecycle costs, supply reliability, system performance, investment cost efficiency, over/under investment, long-term planning.","Climate Change: (Temperature, precipitation changes, sea level rise, extreme weather, flood frequency, hydrological conditions, streamflow, water supply, climate sensitivity), Technological Development/Diffusion, Market Imperfections, Deep Uncertainty (model specification, probability distributions, valuation, future conditions), Demand Uncertainty (air traffic, water, LNG), Policy Failure/Static Policies, Adaptation Tipping Points, Coordination Failures, Imperfect Information, Heterogeneous Preferences, Discount Rate, Financial Crises, Terrorist Attacks, Natural Disasters, External Shocks, Scenarios (growth, water levels), Vulnerability (Water Supply).","Scenario Discovery (SD), CMIP5 climate ensemble, transient scenarios, country-specific climate scenarios, Monte Carlo simulation, stochastic weather generators, GCM ensembles.","The material focuses on methodologies for addressing climate change risks and adaptation under deep uncertainty (DMDU). Key approaches include: Robust Decision Making (RDM), involving scenario discovery, exploratory modeling, vulnerability analysis, and iterative strategy development; Dynamic Adaptive Policy Pathways (DAPP), which emphasizes proactive planning, monitoring, trigger responses, and flexible adaptation over time; Engineering Options Analysis (EOA), exploring alternative strategies and wise first steps for infrastructure developments; and Info-Gap Decision Theory (IG), which prioritizes robust satisficing by evaluating decisions based on their tolerance to uncertainty while meeting performance requirements, using robustness and opportuneness functions. Also mentioned are sensitivity analysis, climate stress tests, and adaptive management approaches (like the Dutch ADM). These methods often involve simulation, scenario analysis, stakeholder engagement, and genetic algorithms to assess policy performance and identify least-regret options across a range of plausible futures. Exploratory modeling and analysis, alongside multi-objective robust optimization (MORO), and various software packages are frequently employed to deal with ""wicked problems"".","Highlights:

*   **Decision-Making Under Uncertainty:** Traditional scientific approaches often fail when dealing with high levels of uncertainty. Decision-making should anticipate change and reduce vulnerability of policies and strategies to uncertain future developments.
*   **Robust Decision Making (RDM) and Dynamic Adaptive Planning (DAP):** RDM helps identify trade-offs, compares decision outcomes across multiple objectives, and focuses on layered and explicit decision-making processes. DAP manages risks by considering 'what if' scenarios, adapting over time, and maintaining flexibility through adaptation pathways.
*   **Adaptation Strategies:** Emphasis on robustness as a property of the ensemble of results. Adaptive strategies are crucial for long-term policy challenges and identifying vulnerabilities in current strategies. Implement adaptive strategies that are successful across a broad range of futures. DAPP makes path dependencies explicit to limit stranded assets and inflexible lock-ins.
*   **Policy Instruments and Approaches:** Combining carbon taxes and technology subsidies may be a promising robust strategy for reducing greenhouse gas emissions. Engineering Options Analysis (EOA) suggests modular, flexible strategies offer greater gains and lower risks. Decision analytic approaches separate decision understanding from future state probabilities. Flexible designs and capacity expansion when demand justifies perform best under uncertainty. The opportuneness strategy seeks windfalls at minimal uncertainty. IG theory is useful when models are expected to improve significantly in the near future.
*   **Robustness vs. Performance:** Robustness trades off against performance, requiring relaxation of performance requirements. Prioritize alternatives according to robustness for critical outcomes.
*   **Water Management:** RDM helps identify vulnerabilities in water management systems and develop adaptive strategies. Adaptive strategies can manage risk more effectively than static strategies but may not eliminate regret.
*   **International Decarbonization:** No single policy is robust across all futures, but independent carbon taxation is a necessary first step.
*   **Flood Management:** DAPP is used to manage flood risk.
*   **DMDU (Decision Making Under Deep Uncertainty) Approaches:** DMDU approaches improve policy analysis by acknowledging deep uncertainties, providing a common vocabulary, and enabling adaptive processes. DMDU helps to improve the adaptivity and robustness of policies, creating a shared strategic vision. DMDU approaches can profit from feedback from researchers and practitioners. DMDU applications offer a body of theory and practice with the potential for providing a common vocabulary to the work of both analysts and of those charged with policy design and implementation during uncertain times.
*   **Key Factors for Success:** Leadership, political backing, and stakeholder engagement are crucial for the adoption of adaptive planning.
*   **Delta Management:** Adaptive Delta Management (ADM) can reduce chances of over- and underinvesting and adaptation pathways are seen as important outcomes.
*   **Stress Testing:** Climate stress tests incorporate correlated behavior of multiple variables and reveal system sensitivities.","The material under review focuses on decision-making under conditions of deep uncertainty, particularly in the context of climate change adaptation and risks. Key themes include developing adaptive strategies, such as Robust Decision Making (RDM), Multi-Objective RDM (MORDM), and Dynamic Adaptive Policy Pathways (DAPP), which facilitate resilience in policy analysis and planning. The emphasis is on navigating uncertainties without relying solely on climate projections, considering political, economic, and technological variables, and using exploratory models and computational tools for quantitative support. The content discusses the implementation challenges in adaptation pathways, particularly in water resource management, flood risk, and delta management, highlighting real-world case studies like the Colorado River Basin and the Netherlands' Delta Programme. It also underscores the importance of flexibility, robustness, and continued engagement between analysts and policymakers to advance these methodologies beyond traditional sectors, extending their applicability to areas like transportation, energy, and health care. The integration of stakeholder feedback and monitoring signals is crucial for timely policy adaptation to preempt adverse effects from climate and socio-economic developments.",Adaptation,,,,,,,,,"The paper primarily focuses on methodologies for decision-making under deep uncertainty (DMDU) related to climate change adaptation, using methods like Robust Decision Making (RDM), Dynamic Adaptive Policy Pathways (DAPP), Engineering Options Analysis (EOA), and Info-Gap Decision Theory (IG). A case study specifically addresses water management vulnerabilities in the Colorado River Basin. Another case study adresses climate technology policy. The examples shown would suggest that water management and infrastructure are likely to be affected.","Benefits of adaptation are quantified using a variety of methods under deep uncertainty, often involving simulation models, scenario analysis, and decision-making frameworks. These methods assess adaptation strategy performance across plausible future scenarios, considering costs, co-benefits, and trade-offs. Specific techniques include Robust Decision Making (RDM), Dynamic Adaptive Policy Pathways (DAPP), Engineering Options Analysis (EOA), and Info-Gap Decision Theory (IG), which employ exploratory modeling, scenario discovery, vulnerability analysis, and robustness assessments to evaluate and compare different adaptation pathways and policies. Benefits are often expressed in terms of reduced vulnerability, minimized regret, improved reliability, and cost-effectiveness. Scorecard approaches are also used to assess various metrics.","Adaptation costs are quantified using various approaches under conditions of deep uncertainty. Decision Making under Deep Uncertainty (DMDU) methods like Scenario Discovery, Robust Decision Making (RDM), and Dynamic Adaptive Policy Pathways (DAPP) are employed. These approaches involve evaluating policies across multiple plausible futures and focusing on robustness rather than optimality. The methodology includes assessing vulnerabilities, performing cost-benefit analyses, and evaluating the performance of adaptation pathways under different climate scenarios. Tools like Monte Carlo simulations are used to explore a wide range of outcomes, identify vulnerabilities, and model adaptive strategies. The costs of adaptation are often analyzed alongside benefits and co-benefits, with scenario-based assessments providing a framework for understanding the economic implications of different adaptation strategies.","The analysis relies primarily on ex-ante modeling, as evidenced by the consistent use of exploratory modeling, scenario discovery, and simulation methods like Robust Decision Making (RDM), Dynamic Adaptive Policy Pathways (DAPP), and Info-Gap Decision Theory (IG). These methodologies focus on evaluating strategies under deep uncertainty by exploring a wide range of plausible futures rather than relying on ex-post observations of past data.","The adaptation planning/decision-making process discussed revolves around dealing with deep uncertainty through methodologies like Decision Making under Deep Uncertainty (DMDU), Robust Decision Making (RDM), Dynamic Adaptive Policy Pathways (DAPP), Engineering Options Analysis (EOA), and Info-Gap Decision Theory (IG). These approaches involve framing analysis, exploring outcomes across scenarios, identifying vulnerabilities, establishing triggers for action, developing adaptive strategies, using exploratory modeling, and monitoring performance. Key elements include scenario discovery, robustness analysis, sensitivity analysis, vulnerability assessments, tradeoff analysis, and iterative processes involving stakeholder deliberation. Adaptive planning and policy pathways are emphasized, allowing for adjustments as the future unfolds, with a focus on flexibility and learning.",,"The paper doesn't offer a single definition of ""sufficient adaptation levels."" Instead, it focuses on methodologies (like RDM, DAPP, EOA, and IG) to make robust decisions under deep uncertainty, emphasizing flexibility and adaptation over time. ""Well-adapted"" in this context means having strategies that perform acceptably across a wide range of plausible futures, minimize regret, and allow for adjustments based on monitoring and pre-defined triggers. It is about identifying vulnerabilities, building resilience, and creating pathways that can be adapted as the future unfolds, rather than achieving a static, optimal endpoint. Performance is often evaluated against objectives, such as water supply reliability or cost thresholds, with a focus on minimizing deviations from desired levels across scenarios.","Soft options, within the DMDU framework, contribute to building resilience and adaptability by facilitating monitoring, learning, and adjustments of climate change strategies over time, enabling effective risk management without relying on precise predictions and allowing for flexible responses to unfolding future conditions."
10.1007/s13412-015-0276-2,Fraser E.D.G. et al.,2015,Food stocks and grain reserves: evaluating whether storing food creates resilient food systems,https://fraserfoodresilience.wordpress.com/wp-content/uploads/2015/11/fraserfoodresilience.pdf,10.1007/s13412-015-0276-2,AI,Step 5,,,,,,,,,,,,,,,,,,,,,,,,
10.1029/2023EF004230,Balaguru et al.,2024,A Global Increase in Nearshore Tropical Cyclone Intensification,https://repository.library.noaa.gov/view/noaa/61151/noaa_61151_DS1.pdf,10.1029/2023EF004230,AI,Step 5,,,,,,,,,,,,,,,,,,,,,,,,
10.1073/pnas.0701976104,Schmidhuber & Tubiello,2007,Global food security under climate change,https://www.fao.org/fileadmin/templates/esa/Global_persepctives/Presentations/Global_food_security_under_climate_change.pdf,10.1073/pnas.0701976104,AI,Step 5,,,,,,,,,,,,,,,,,,,,,,,,
10.1038/s41558-021-01236-x,Gambhir et al.,2022,Near-term transition and longer-term physical climate risks of greenhouse gas emissions pathways,https://centaur.reading.ac.uk/101855/1/Integrated%20climate%20risk%20assessment%20NCC%20manuscript_no%20tracked%20changes_2%20Nov%202021.pdf,10.1038/s41558-021-01236-x,AI,Step 5,The provided notes do not specify any particular country or group of countries.,Macroeconomic Risks; Abatement Costs (GDP %); Transition Risk; Fiscal Expenditure; Investment Returns; Asset Devaluation; Financial Risks (Firm/Household); Default Probability; Credit Risk; Credit Ratings; Systemic Risk; Economic Output; Electricity Prices; Crop Prices; Drought Exposure; River Flooding; Heatwave Exposure; Crop Yield Reduction; Agricultural Productivity.,"Emissions scenarios; Temperature changes; Acute events (heatwaves, floods, drought); Crop impacts; Mitigation scenarios; Technological assumptions (renewables, CCS, nuclear); Carbon prices; Stranded assets; Fossil fuel demand; Electricity/food prices; Abatement costs; Transition risks; Physical climate hazards; Carbon intensity; Investor exposure; Financial sector effects; Physical hazard indicators; Transition risk indicators; Coal plant capacity; Energy portfolio defaults; Household energy costs; Transition dynamics; Global mean surface temperature; Drought impacts; Crop yield potential; Maize reproductive phase.","2C Central, multiple 2oC pathways, IPCC scenario databases, NGFS results database, GCAM version 5.1 emissions scenarios, MAGICC4.2, CMIP5 climate models, five SSP socio-economic scenarios.","The analysis employs climate scenarios and integrated assessment models (IAMs) such as GCAM (v5.1) and MAGICC (v4.2) to project temperature changes, abatement costs, and macroeconomic risks associated with different emission pathways. It normalizes physical risk metrics to 2050 values under a 2°C scenario and uses a reference period of 1981-2010 for physical climate impacts. The framework downscales outputs from IAMs to assess financial risks at firm and household levels, considering multiple 2°C pathways and comparing physical and transition risks, especially around mid-century. The analysis includes scenario data analysis and visualization, financial risk analysis, and literature review. Transition risk indicators are used to assess carbon leakage, mitigation feasibility, and stranded assets under 1.5°C and 2°C scenarios. Land-use change emissions are considered in relation to fossil fuel emissions prices. Spatially-explicit global-scale impact models are used to calculate hazard indicators based on damage functions constructed from CMIP5 climate models. Observed climate time series (1981-2010) with pattern-scaling are used to simulate river flows (Mac-PDM.09) and define drought (SRI), with specific indicators for agricultural drought (SPEI) and maize crop impacts.","Climate change risks are highly dependent on temperature pathways. Physical risks are most sensitive to temperature by 2050, while transition risks are more sensitive by 2030 and depend on technology, policy, and socio-economic factors for 2°C targets. A ""No Policy"" scenario projects a 4.3°C rise by 2100, compared to 3.1°C under current NDC pledges and a peak of 1.7°C around 2050, returning to below 1.5°C by 2080 in a 1.5°C scenario. Major heatwaves and agricultural impacts show non-linear relationships with temperature; India is particularly vulnerable to river flooding and agricultural drought. The 1.5°C scenario results in higher global abatement costs. Transition risk-temperature pathway relationships vary by region and model. Near-term transition risks are significant for specific business sectors, increasing with mitigation stringency, and similar long-term physical risks can have vastly different near-term transition risks. Emissions intensity at the sectoral level is a key metric for benchmarking company performance. Drought, more so than temperature, can significantly impact maize yields, especially in water-limited regions. Risk assessments should account for uncertainty and extreme values, as single-model analysis provides limited context.","Synopsis: The analysis uses scenario-based modelling, focusing on energy-economic pathways and financial implications, primarily exploring global and regional climate risks relative to a 2C Central scenario. It examines transition risks, rather than physical climate risks, and doesn't account for adaptation measures, potential growth stimulus from low-carbon investment, or land use changes. Hazard is expressed as annual likelihood and population exposure, using maize as a proxy for agricultural impacts. Limitations include focusing on relative risk changes, a hypothetical ""No Policy"" scenario, and potential benefits of futures analysis and systemic risk considerations.",Macroeconomic/Fiscal,,Stylised changes,Adaptive,Global,Sequential Interactions,Transitional (accounting for changes over time),,"Hazards are calculated using spatially-explicit, global-scale impact models. Indicators reported in IPCC and NGFS databases are used to understand macroeconomic risk. Climate scenarios are applied to observed climate time series. River flows are simulated using a global hydrological model. Drought is defined using the Standardised Runoff Index (SRI). Agricultural drought is calculated using the Standardised Precipitation Evaporation Index (SPEI). Changes in growing degree-days for maize are calculated, along with the likelihood of damaging temperatures during the maize reproductive phase. Damage functions relating hazard indicators to temperature increases are constructed, considering different socio-economic scenarios.",,,,,,,,
10.21162/PAKJAS/21.885,Arshad et al.,2021,The effect of climate change on cotton productivity - an empirical investigation in Pakistan,https://api.pakjas.com.pk/downloadPaper/The%20effect%20of%20climate%20change%20on%20cotton%20productivity%20-%20an%20empirical%20investigation%20in%20Pakistan.pdf,10.21162/PAKJAS/21.885,AI,Step 5,Pakistan,Cotton productivity; National GDP (10%); Losses (10-15%); Pakistan; TFP.,"Climate Change: Temperature, Rainfall, CO2 Levels/Emissions. Agricultural Inputs: Fertilizer, Seed Consumption, Area. Socioeconomic Factors: Labor, Infrastructure. Extreme Weather Fluctuations. Cotton Productivity.","This paper focuses on econometric modeling using time series data from Pakistan (1970/71-2018) and does not explicitly analyze outcomes under different socioeconomic or climate scenarios. The analysis relies on statistical methods like ARDL, OLS, SFA, and co-integration tests.","Methodology: The analysis utilizes time series data (1970/71-2018) for Pakistan and employs Autoregressive Distributed Lag (ARDL) models, including ARDL bound testing for co-integration. Robustness checks involve Dynamic Ordinary Least Squares (OLS), Johansen co-integration, and unit root tests. Stochastic Frontier Analysis (SFA) is used in at least one instance. Model stability is assessed using CUSUM and CUSUM of Squares tests.","Climate change (temperature, rainfall, CO2) significantly impacts cotton productivity in Pakistan, which affects 10% of national GDP. Rainfall, infrastructure, fertilizer, and seed consumption positively influence productivity, while CO2 emissions and labor have negative impacts. Temperature's effect is complex, with high temperatures decreasing yields, but average temperature increases potentially boosting production. The analysis incorporates both climate and non-climate factors like labor, infrastructure, and agricultural inputs, using econometric techniques and identifying co-integration among the variables.","Pakistan-focused study on cotton productivity. Model adaptable to other developing countries, but limited by data availability, excluding factors like subsidies and household socio-economic status. Time series analysis highlights the importance of government support for climate-resilient cotton production.",Macroeconomic/Fiscal,Econometric,,Adaptive,,,Transitional (accounting for changes over time),,"Econometric models (ARDL, Dynamic OLS, Johansen co-integration, SFA) are employed on Pakistan time-series data (1970/71-2018) to examine long-run and short-run relationships between climate and economic variables. The impact of climate and non-climate variables on cotton productivity is examined, with model stability assessed via CUSUM tests.",,,,,,,,
10.3390/su10103757,Zhang et al.,2018,The Role of Climate Factors in Shaping China's Crop Mix: An Empirical Exploration,https://pdfs.semanticscholar.org/3558/26372f2870509487656f7402d147699d6b6a.pdf,10.3390/su10103757,AI,Step 5,,,,,,,,,,,,,,,,,,,,,,,,
10.3390/w13101335,Faggian,2021,Future Precipitation Scenarios over Italy,https://pdfs.semanticscholar.org/0b6e/f7224570a8004b4a78b80ab71d7fc96baf93.pdf,10.3390/w13101335,AI,Step 5,,,,,,,,,,,,,,,,,,,,,,,,
10.5194/hess-16-4603-2012,Lauri et al.,2012,Future changes in Mekong River hydrology: impact of climate change and reservoir operation on discharge,https://core.ac.uk/download/pdf/26974676.pdf,10.5194/hess-16-4603-2012,AI,Step 5,,,,,,,,,,,,,,,,,,,,,,,,
10.1016/j.envint.2024.108691,Wu Y. et al.,2024,Temperature frequency and mortality: Assessing adaptation to local temperature,https://arrow.tudublin.ie/cgi/viewcontent.cgi?article=1253&context=scschphyart,10.1016/j.envint.2024.108691,AI,Step 5,,,,,,,,,,,,,,,,,,,,,,,,
10.1360/TB-2024-0439,Zhang S. et al.,2024,"Taking stock of climate action for a healthy and thriving future; [盘点气候风险机遇, 展望健康繁荣未来]",https://pure.iiasa.ac.at/id/eprint/20013/1/B41F001ECFA34CC2A9151067911B50C4-mark.pdf,10.1360/TB-2024-0439,AI,Step 5,China,Labor productivity; Heatwaves.,"Extreme weather events; Climate change; Greenhouse gas emissions (CO2, methane); Air pollution (PM2.5); Human activities.","This paper focuses on tracking progress on health and climate change in China using 28 indicators, but doesn't explicitly state the socioeconomic or climate scenarios under which the outcomes were analyzed.",The 2023 China Report of the Lancet Countdown tracks progress on health and climate change in China through 28 indicators across five domains.,"China experienced record heat and droughts in 2022, leading to economic losses from adverse health outcomes, including increased mortality and work loss, disproportionately impacting southern and western regions. Human-caused climate change significantly contributed to these impacts.","The material emphasizes the integration of health into climate intervention strategies, noting that health is often not explicitly targeted. It highlights the need for independent warning systems for extreme heat and discusses the health impacts of climate change, particularly in China. Recommendations include investing in renewable energy, reducing carbon and air pollutants, creating meteorology-informed early warning systems, researching extreme weather events, and developing health adaptation guidelines tailored for various stakeholders.",Macroeconomic/Fiscal,,,,,,,,Adaptation measures are observed through health and climate change progress indicators.,,,,,,,,
10.5670/oceanog.2020.224,Miller K.G. et al.,2020,Ancient sea level as key to the future,https://pdfs.semanticscholar.org/126f/182387a1b9a701960abaf85b555660f40b8e.pdf,10.5670/oceanog.2020.224,AI,Step 5,,,,,,,,,,,,,,,,,,,,,,,,
10.1108/IJCCSM-04-2018-0030,Hossain M.S. et al.,2019,Climate change and crop farming in Bangladesh: an analysis of economic impacts,https://pdfs.semanticscholar.org/1a2e/4cda009136a3d85ddaab4495ca9e1e9bf743.pdf,10.1108/IJCCSM-04-2018-0030,AI,Step 5,,,,,,,,,,,,,,,,,,,,,,,,
10.3390/atmos12030305,Melo & Foster,2021,Agricultural and Forestry Land and Labor Use under Long-Term Climate Change in Chile,https://pdfs.semanticscholar.org/d54e/ec48e650dc5ddadf673d541fcb371c7072db.pdf,10.3390/atmos12030305,AI,Step 5,,,,,,,,,,,,,,,,,,,,,,,,
10.1029/2001GB001827,Berthelot et al.,2002,Global response of the terrestrial biosphere to CO2 and climate change using a coupled climate-carbon cycle model -: art. no. 1084,https://web.lmd.jussieu.fr/~jldufres/publi/2002/Berthelot.Friedlingstein.ea-gbc-2002.pdf,10.1029/2001GB001827,AI,Step 5,,,,,,,,,,,,,,,,,,,,,,,,
