DOI,Author(s),Year,Paper Title,Link to paper,Paper ID,Reviewer,Status,Country(ies),Outcome(s) of Interest,Drivers of Risk,Scenario(s),Methodology,Highlights,More Notes,Applicability,Calibration Approach,Hazard definition,Impact persistence,Space disaggregation,Impact interactions,Economic dynamics,Climate features,Adaptation considered,Impacted Sector,Benefits of Adaptation,Costs of Adaptation,Ante/Post?,Planning Process,"""Soft Options""",Sufficiency Definition,Soft Options
10.1111/roiw.12719,Nakamura L. & Sliker B.,2025,Climate Shocks in the Anthropocene Era: Should Net Domestic Product Reflect Climate Disasters?,found,10.1111/roiw.12719,AI,Step 5,No specific country or group of countries was mentioned in the provided notes.,Asset damage; CFC impact; NDP impact; Disaster costs; Expected losses; National accounts.,"Climate change impacts; Extreme weather events (hurricanes, fires, storms, drought); Natural disasters (earthquakes, volcanoes, tidal waves); Human error; War and political events; Technological accidents; Asset deterioration; Obsolescence.",Historical disaster data analysis (1980-2023) within the System of National Accounts framework.,"Methodology includes statistical analysis, structural modeling, meta-analyses, and AR5 methods. The analysis tracks disaster costs, net domestic product (NDP), and consumption of fixed capital (CFC) from 1980-2023, calculating ratios to assess economic impact. It addresses the System of National Accounts (SNA) treatment of disaster costs, comparing current methods to the pre-2008 US BEA approach, suggesting including a trend of expected disaster costs in CFC instead of full disaster costs (currently recorded in 'other changes in the volume of assets account'). It also uses a trend as an estimate and the CPI to create a real series.
","Economic impact estimates vary significantly across modeling approaches as global temperatures rise. Extreme weather events are becoming more frequent and predictable. Disaster costs, while a relatively small portion of NDP, are increasing over time, exhibiting significant volatility. Using a trend-based approach rather than full disaster costs may provide a smoother and better proxy for expected costs. Catastrophic losses are associated with large-scale events destroying significant assets.","Accounting for weather/climate disaster damage as regular capital consumption is proposed. The analysis uses empirical data from NOAA NCEI (2024) and assumes unbiased expectations. The focus is on identifying events causing significant asset losses for inclusion in national accounts, but the text does not quantitatively estimate macroeconomic or fiscal impacts, analyze adaptation, or provide extensive methodological details. Future research directions are briefly mentioned.
",Macroeconomic/Fiscal,Econometric,Acute shocks,Adaptive,,,Transitional (accounting for changes over time),,"Existing national accounting frameworks capture disaster-related asset damage through 'consumption of fixed capital' or, less desirably, in 'other changes in the volume of assets'. A shift towards incorporating a trend of expected disaster costs within 'consumption of fixed capital' is suggested for better accounting of climate impacts. Disaster costs, net domestic product, and consumption of fixed capital are tracked and analyzed over time.",,,,,,,,
10.1016/j.euroecorev.2024.104819,Kotlikoff L. et al.,2024,Can today's and tomorrow's world uniformly gain from carbon taxation?,found,10.1016/j.euroecorev.2024.104819,AI,Step 5,"India, BRA, SAP, MENA, SLA, SSA, US","GDP effects (national, regional, global; losses/gains; shares); Welfare (UWI, consumption compensating variation/differentials, intergenerational distribution); Social Cost of Carbon (SCC); Regional damages (percent of GDP); Interest rate; Consumption; Productivity (TFP); Macroeconomic and fiscal outcomes (productivity, interest, budget balance, public expenditure).","Climate change, global and regional temperature, anthropogenic emissions, carbon emissions, technological advances, fossil fuel reliance, carbon taxation, Total Factor Productivity (TFP), fossil fuel prices, climate policy, dirty energy substitutability, carbon taxes, emissions from production, regional temperatures, damage scenarios, energy dependence, infinite coal reserves, substitutability of energy, damage functions, policy effectiveness, global carbon tax, anticipatory extraction, carbon leakage, uncertainty-weighted impacts, BAU damages, climatic risk events (rainfall, hurricanes, floods)","RCP8.5, BAU, UWIL, UWIF, UWI, DICE, CMIP5","The methodology employs a large-scale, annually calibrated, multi-region overlapping generations (OLG) model with 18 regions, calibrated to UN demographic data, and involves up to 80 generations to examine macroeconomic and macro-fiscal risks alongside carbon policies. The model integrates capital, labor, clean and dirty energy to produce output, with region-specific emissions and damages assessed through pattern scaling techniques to ascertain regional temperatures. It calibrates damage functions using the Krusell and Smith (2022) and DICE 2016 models, incorporating updates from Folini et al. (2024), to study various policies like Universal Welfare Increase (UWI), focusing on regions' capacities for individual climate change mitigation.

Two approaches are utilized: dynamic economic modeling with CES production functions and general equilibrium models, exploring competitive equilibriums and finite energy reserves. The analysis evaluates the economic impacts of carbon policies while modeling regional GDPs, Total Factor Productivity (TFP), and emissions scenarios. Models simulate impacts of varying carbon tax policies and transfer schemes across different damage function specifications under Business As Usual (BAU) scenarios, comparing these to IPCC RCP scenarios. 

The study uses computed general equilibrium models and dynamic fiscal policy frameworks extending projections to 2250, iterating through numerical solutions to optimize global carbon tax rates. Other elements include simulating economic transformations with gradual clean energy transitions, using data from sources like the World Bank and EIA, while analyzing regional commodity consumption impacts. Regional SCC calculations assess emissions' damages, benefiting policy formation at national and global levels.","Synopsis: Climate change will differentially undermine regional economic growth, with India particularly vulnerable. While labor productivity growth remains a dominant economic driver, climate damages can be significantly mitigated by global carbon taxation, particularly through a uniform welfare improving (UWI) carbon tax coupled with redistribution. However, even optimal carbon tax policies can only limit peak global damages by a limited amount. China's participation in carbon policy is critical. The speed of transitioning to clean energy has limited impact on the optimal taxation path, though it affects short/medium-term dirty energy use. Regional total factor productivity peaks at an optimal temperature, with deviations causing losses. Absent policy, some regions (Russia, Canada) may initially gain from warming. Optimal initial carbon taxes are sensitive to the damage function, and the UWI policy involves significant intergenerational transfers. While carbon taxation can dramatically reduce regional damage, the social cost of carbon (SCC) varies regionally, with China and the US being the most significant. Carbon taxation needs to be global to be effective, and delaying action reduces UWI gains. The redistributive aspect of UWI might be politically challenging due to the high taxes on future cohorts and vulnerable regions; UWI with limits (UWIL) can improve welfare in some cases. Regional SCC can be lower than global, limiting the benefits of partial participation.","This research employs a regionalized integrated assessment model (IAM) with feedback loops between temperature, damages, production, and emissions to analyze the macroeconomic and macro-fiscal impacts of climate change and carbon taxation policies. The model features region-specific temperature and damage functions, technologies, and resource extraction costs, including non-negative dirty energy consumption and increasing extraction costs as reserves decline. It incorporates clean and dirty energy, capital mobility via a world interest rate, and three carbon reservoirs. The analysis focuses on the production side of the economy and considers a millennium time horizon for stabilization, using a certainty-equivalent approach. Different carbon policy scenarios are simulated, including uniform carbon tax with various transfer schemes (UWI, UWIF, UWIL) to address distributional concerns across regions and generations, and the potential for sovereign debt defaults. Key findings relate to the impact of climate change damage levels on outcomes, the influence of transfer schemes on welfare distribution, the effectiveness of carbon taxation in achieving emission reductions near Paris Agreement targets, and potential time consistency problems with future taxes, alongside issues of fairness. The model is calibrated using energy consumption data and incorporates assumptions from DICE and other studies, comparing its damage predictions with DICE (2017). Scenarios are run to 2217. The study considers the 'Green Paradox' and acknowledges the importance of gradual transition and technological improvement, such as carbon capture, and incorporates the possibility that some regions might initially benefit from climate change. The analysis uses country groupings such as ANZ, BRA, CND, CHI, EEU, GBR, IND, JSHK, MENA, MEX, RUS, SAF, SAP, SLA, SOV, SSA, US, and WEU, projecting that China and India will account for a significant portion of global GDP by 2100. The model analyzes the effects of carbon taxes on coal, oil, and gas usage.",Macroeconomic/Fiscal,,Chronic trends,Permanent,Regional,Spatial Interactions,Transitional (accounting for changes over time),,"The analysis primarily focuses on carbon tax policies and their impact on welfare, energy consumption, and economic output under various climate damage scenarios. Clean energy transitions and the substitutability of clean and dirty energy are modeled. Damage functions relate temperature increases to economic losses. Regional vulnerabilities are captured through region-specific temperatures derived from pattern scaling.",,,,,,,,
10.5194/hess-28-2223-2024,Liu Y. et al.,2024,Reframing water demand management: A new co-governance framework coupling supply-side and demand-side solutions toward sustainability,found,10.5194/hess-28-2223-2024,AI,Step 5,,,,,,,,,,,,,,,,,,,,,,,,
10.1016/j.wroa.2024.100223,Ross A.G. et al.,2024,A macro-level analysis of the socio-economic impacts of climate change driven water scarcity: Incorporating behavioural and resilience aspects,found,10.1016/j.wroa.2024.100223,AI,Step 5,Germany,GDP; Employment; Investment; Water Use; Sectoral Impacts; Economic Resilience,"Water scarcity events; droughts; temporal distribution (May, August); shock intensity; economic openness; trade elasticity; investment behavior (Myopic, Imperfect Foresight, Perfect Foresight).","Water scarcity scenarios, combined with varying investment behavior models (Perfect foresight, Myopic expectations, and Imperfect foresight).","The study employs the DEMACRO-ESS simulation model, a dynamic multi-sectoral computable general equilibrium (CGE) model parameterized on a 2020 Social Accounting Matrix for Germany. DEMACRO-ESS extends the standard DEMACRO model to incorporate water and land as natural capital, utilizing multi-level production functions with CES and Armington elasticities and allowing for labor market imperfections. The model features (neo) Keynesian characteristics, simulates monthly frequency, and incorporates different investment behavior specifications (perfect foresight, myopic expectations, and imperfect foresight). Scenarios of temporal water scarcity are incorporated by reducing the water efficiency parameter, and sensitivity analysis is conducted by varying Armington trade elasticity. The model is used to analyze the macroeconomic and sectoral effects of water scarcity.","Highlights: Water scarcity negatively impacts GDP, investment, employment, and water use, with the severity and recovery time dependent on the shock's intensity and timing, and firms' investment behavior (foresightful vs. myopic). Proactive measures and investment foresight significantly mitigate negative economic effects. Water-dependent sectors like agriculture, food, and electricity are negatively impacted, while some sectors may benefit from competitiveness effects, potentially increasing water use. Open economies can experience a positive GDP effect but negative employment impact during water scarcity. The agriculture, forestry, & fishing sector consistently suffers the most significant negative impacts on GDP, employment, and water use.","A model analyzing water scarcity impacts in Germany explores investment foresight scenarios (myopic, imperfect, perfect) and their effect on economic trajectories. It incorporates green and blue water, land types, and labor mobility, but assumes fixed labor force size. Business-as-usual conditions are assumed for Germany's trade partners. Competitiveness effects and changes in consumer spending partly mitigate negative impacts in some sectors, especially electrical and vehicle manufacturing, but significant impacts are observed in the food and beverage industries due to their dependence on agriculture. Results are presented as percentage changes relative to a baseline without water scarcity. Applicability to other countries may be limited by the model's German-specific parameterization. Findings and policy recommendations may be relevant to other countries and regions.",Macroeconomic/Fiscal,,Chronic trends,Adaptive,,Sequential Interactions,Adaptive (reflecting shifts in economic behavior in response to impacts),,"Adaptation isn't explicitly mentioned in the notes provided. The model simulates the impact of water scarcity under different investment behaviors (myopic, imperfect foresight, perfect foresight) which *could* be interpreted as different adaptation strategies, but the analysis focuses on the *effects* of water scarcity rather than explicitly modeling *adaptation* actions. The varying investment behaviors affect how economic actors respond to the shock of water scarcity, rather than modelling adaptation directly.",,,,,,,,
10.1080/17565529.2022.2074349,Shayegh S. & Dasgupta S.,2024,"Climate change, labour availability and the future of gender inequality in South Africa",found,10.1080/17565529.2022.2074349,AI,Step 5,South Africa,"GDP/Output per capita reduction, labor supply (hours worked), labor productivity, wage inequality (gender, skill), sectoral productivity, price changes, children's education, food security, health.","Temperature (maximum, mean, weekly), precipitation, floods, droughts, RCP scenarios, sectoral productivity, labor availability/supply/productivity, high-exposure sectors.",SSP2 and RCPs,"The study employs a structural, dynamic overlapping generations (OLG) model calibrated to South African data (2008-2017 NIDS panel data) to assess the macroeconomic impacts of climate change on labor supply and wages, particularly gender wage gaps. The methodology combines econometric analysis, including truncated Poisson models, OLS regressions, and two-stage least squares (2SLS), with fixed effects (household, week, year-season), to estimate the impact of temperature on labor supply. Regression models control for various factors (age, marital status, education, health, income, precipitation) and differentiate by sector exposure level (high/low) and gender. Empirical findings are used to calibrate damage functions within the OLG model, projecting future scenarios under RCPs and SSP2. A Computable General Equilibrium (CGE) model with CES production and utility functions is incorporated, along with stochastic modeling and linear production functions to model gender substitution and sectoral skill intensities. The model simulates climate change impacts on labor productivity and sectoral adjustments, considering non-linear temperature effects differentiated by skill and gender.","Climate change negatively impacts labour supply, particularly for women, due to temperature deviations from optimal levels. While climate change may reduce gender and skill-based wage gaps, especially in high-exposure sectors and among low-skilled workers, these gains are likely offset by overall economic losses due to reduced labour availability and productivity. Maximum temperatures significantly affect labour supply, while average temperatures are a better indicator of damages to labour demand. Adaptation policies should target leveraging potential reductions in the gender pay gap, especially in rural communities. Climate change affects both labour supply and demand, leading to complex impacts on wage inequality and sectoral reallocation.","The study evaluates the macroeconomic and macro-fiscal risks of climate change, specifically relating to gender impacts on labor markets in South Africa, with additional insights from Uganda. Climate change is treated akin to external shocks (e.g., war) but highlights differences in male versus female labor impact. It models climate change effects on labor supply without accounting for shifts in unemployment or wage equilibrium, using scenarios RCP2.6 and RCP8.5 and productivity estimates by Desmet & Rossi-Hansberg. Regression analyses segregate data into high and low exposure groups by gender, also distinguishing impacts on different sectors using South African data. Indirect effects on labor and wage dynamics under general equilibrium conditions are considered, factoring in RCPs and SSPs. The analysis emphasizes the gender pay gap, sector-specific labor divisions, and does not assess future gender wage equalization policies. It discusses the socio-economic implications of climate change, identifying vulnerable groups, and supports policy design for adaptation. The study employs temperature thresholds (21.1°C and 17.4°C) to assess productivity peaks in specific sectors.",Macroeconomic/Fiscal,,Chronic trends,Permanent,Regional,Sequential Interactions,Adaptive (reflecting shifts in economic behavior in response to impacts),,"Impacts of temperature on labour supply, differentiated by sector, skill, and gender, are empirically analysed and incorporated into an OLG or CGE model. These models project future economic outcomes under different climate scenarios (RCPs and SSPs) by considering changes in labour productivity and wages due to climate change. Labour reallocation between sectors is also considered.",,,,,,,,
10.1038/s41467-023-43114-4,Krichene H. et al.,2023,The social costs of tropical cyclones,found,10.1038/s41467-023-43114-4,AI,Step 5,41 TC-affected countries,"Economic growth, GDP trajectories/deviations, GDP per capita growth, Social Cost of Carbon (SCC), Tropical Cyclone-induced SCC (TC-SCC), Discounted Annual Damage (DAD), per-capita DAD (DADpc), household income loss, growth losses (tropical cyclones), economic losses.","Tropical Cyclones (TCs), Temperature (Global Mean Temperature/Increases), Greenhouse Gas (GHG) Emissions (and emission scenarios such as RCPs), Climate Change (and climate change scenarios), Socioeconomic Development (SSPs), Discount Rate/Normative Assumptions on Discounting, Extreme Weather Events.","RCPs, SSPs","The methodology employs a modeling framework combining historical growth responses to tropical cyclone (TC) strikes (accounting for damage persistence), probabilistic event-based TC damage projections (using a TC emulator), and event-based temperature-dependent damage functions. It uses a three-way fixed effects panel model with annual national shares of population exposed to TCs to estimate national GDP per capita growth responses (1981-2015), incorporating country and time fixed effects, country-specific time trends, temperature effects (quadratic), and lagged TC wind exposure. Scenario analysis and bootstrapping (1200 bootstraps per country) are used to project TC damages from 2010-2100, fully propagating six uncertainty dimensions (UD1-UD6). The approach translates affected populations into GDP deviations using an empirical growth model, and warming into economic damages using temperature damage functions. The social cost of carbon (SCC) is calculated following Ricke et al. (2018) by assessing GDP per capita projection differences with and without an additional emission pulse, using growth-adjusted discounting and discount rates from Stern and DICE models. Considers RCPs, SSPs, CMIP5-GCMs, probabilistic TC time series. Structural dependence is tested using F-tests. The methodology builds on integrated assessment models, growth econometrics, and Damage as a percentage of income (DAD) analysis.","Tropical cyclones (TCs) significantly increase the global social cost of carbon (SCC), particularly for major greenhouse gas emitters like India, USA, China, Taiwan, and Japan, suggesting current climate policy benefits are underestimated. TCs induce growth losses in the short-, mid-, and long-term, with heterogeneous impacts across countries, leading to substantial discounted annual damage (DAD). Growth losses increase with global mean temperature (GMT), affecting even high-income countries, implying insufficient adaptation. The relationship between GMT and TC-induced growth is RCP-dependent. Low- and middle-income countries face greater adaptation challenges. Temperature and TC impacts affect GDP per capita growth; omitting either does not significantly change the estimated coefficients of the other.  The TC-induced SCC (TC-SCC) is the difference between the SCC with and without TCs, and discount rates significantly affect SCC estimates.","The research investigates the macroeconomic impacts of climate change, particularly tropical cyclones (TCs), focusing on developing evidence-based National Adaptation Plans (NAPs). It uses metrics like Damage from Cyclones (DAD) and the Social Cost of Carbon (SCC), noting current SCC estimates don't fully account for long-term TC effects. The study employs a common regression framework analyzing per-capita GDP growth in relation to temperature and TC impacts, using data from 166 countries plus 8 TC-affected regions. Key data sources include GSWP3-W5E5 (temperature), HYDEv3.3 (population), and ISIMIP2b (future climate scenarios). Analysis considers lagged growth losses and uses growth-adjusted discount rates. Uncertainty stems primarily from national shares of affected populations, historical growth responses to TCs, and discounting. Differences in national income levels are crucial for comparing adaptation challenges. The framework can be extended to other extreme weather events. The model to generate probabilistic TC tracks is intellectual property of WindRiskTech. The research is funded by various sources, including the German Federal Ministry of Education and Research (BMBF) under projects SLICE and QUIDIC and the CHIPS project (AXIS ERA-NET), offering potentially relevant datasets and models. The paper references other studies concerning the economic impacts of tropical cyclones and climate change.",Macroeconomic/Fiscal,Econometric,Acute shocks,Permanent,Global,Sequential Interactions,Transitional (accounting for changes over time),,"Indirectly, through modeling of temperature-dependent damages and projections of TC impacts under different climate scenarios. Assesses economic impacts (GDP deviations, growth rate changes) considering uncertainties. Scenarios and damage functions incorporate elements that could influence future adaptation needs or effectiveness.",,,,,,,,
