DOI,Author(s),Year,Paper Title,Link to paper,Paper ID,Reviewer,Status,Outcome(s) of Interest,Outcome(s) of Interest-sourcematerial,Drivers of Risk,Drivers of Risk-sourcematerial,Category,Category-sourcematerial,Approach,Approach-sourcematerial,Methodology,Methodology-sourcematerial,Highlights,Highlights-sourcematerial,More Notes,More Notes-sourcematerial,Hazard definition,Hazard definition-sourcematerial,Impact persistence,Impact persistence-sourcematerial,Space disaggregation,Space disaggregation-sourcematerial,Impact interactions,Impact interactions-sourcematerial,Economic dynamics,Economic dynamics-sourcematerial,Climate features,Climate features-sourcematerial,Adaptation considered,Adaptation considered-sourcematerial
10.1111/roiw.12719,Nakamura L. & Sliker B.,2025,Climate Shocks in the Anthropocene Era: Should Net Domestic Product Reflect Climate Disasters?,found,10.1111/roiw.12719,AI,Step 6,"Climate change-driven natural disasters lead to asset depreciation, impacting CFC, NDP, and net domestic investment.","""Much of this trend in asset losses is likely due to climate change, and implies a faster depreciation of real assets. We argue that the expected depreciation from these events should be included in consumption of fixed capital (CFC), leading to lower levels and slightly lower growth rates for net domestic product (NDP) and net domestic investment.""","Billion-dollar disasters, extreme weather, predictability, asset costs, NOAA data, large-scale events.","- Page 6: ""Extreme weather events are more frequent (more “normal”) and likely to become more so. Scientific progress has made these events more predictable.""
- Page 8: ""Drivers of Risk: Disasters such as floods, storms, fires, droughts, heat waves."", ""They choose individual disasters with costs greater than $1 billion (in today’s dollars, CPI deflated)."", ""NOAA has collected data back to 1980 on US weather and climate disasters.""
- Page 10: The primary drivers of risk identified are billion-dollar weather and climate disasters.
- Page 15: ""Large scale, discrete and recognizable events impacting assets include earthquakes, volcanic eruptions, tidal waves, hurricanes, droughts, wars, riots, and technological accidents.""","Climate Hazards (Flooding, Storms, etc.)","Page 8: The page focuses on the asset costs of weather and climate disasters in the US. - Evaluation overview: ""Can use both sources to estimate asset costs of disasters"" - Drivers of Risk: ""Disasters such as floods, storms, fires, droughts, heat waves."" - Methodology: ""The National Oceanic and Atmospheric Administration (NOAA) has collected data back to 1980 on US weather and climate disasters"", ""Based mainly on government and private insurance data (extrapolated to cover uninsured claims)"", ""BEA also measures disaster data""

Page 10: The analysis provides an overview of the economic impact of billion-dollar weather and climate disasters on Consumption of Fixed Capital (CFC) and Net Domestic Product (NDP) in the U.S.",Econometric,"They use Poisson pseudo-maximum-likelihood regressions to estimate this expectation and to generate our experimental measure of costs. Page 3: Statistical modeling, Structural modeling, Meta-analyses, AR5 various methods. Page 8: Evaluation overview: ""Can use both sources to estimate asset costs of disasters"" ","The study uses NOAA data from 1980 onwards on U.S. weather and climate disasters costing over $1 billion (CPI deflated) and BEA disaster data focusing on events costing more than 0.1% of GDP; cost data is based on government and private insurance data, extrapolated to include uninsured claims, and is adjusted for inflation using the consumer price index.","""The National Oceanic and Atmospheric Administration (NOAA) has collected data back to 1980 on US weather and climate disasters"", ""They choose individual disasters with costs greater than $1 billion (in today’s dollars, CPI deflated)."", ""BEA also measures disaster data"", ""Mainly includes only very big disasters (bigger than 0.1 % of GDP)."", ""Based mainly on government and private insurance data (extrapolated to cover uninsured claims)"", ""The consumer price index is used to create a real series.""","The economic burden of weather and climate disasters is growing, reaching 0.40% of NDP in 2023, and should be included in consumption of capital.","Proposal: The trend for asset damage from weather and climate disasters should be included in consumption of capital rather than Other Changes in the Volume of Assets. Key findings highlight the growing economic burden of weather and climate disasters on CFC and NDP, with disaster cost as a portion of NDP reaching 0.40% in 2023.","The paper advocates for including the trend of asset damage from increasingly frequent and predictable extreme weather events in the consumption of fixed capital (CFC), a departure from the current System of National Accounts (SNA08) which treats infrequent major natural disasters as ""other changes in the volume of assets;"" the paper utilizes a trend as the best estimate of expected losses due to catastrophic natural and human-made events.","""The world has changed since SNA08: Extreme weather events are more frequent (more “normal”) and likely to become more so. Scientific progress has made these events more predictable. Proposal: The trend for asset damage from weather and climate disasters should be included in consumption of capital rather than Other Changes in the Volume of Assets."" ""The volume changes recorded as catastrophic losses in the other changes in the volume of assets account are the result of large scale, discrete and recognizable events that may destroy a significantly large number of assets within any of the asset categories...They include major earthquakes, volcanic eruptions, tidal waves, exceptionally severe hurricanes, drought and other natural disasters."" ""The paper assumes unbiased expectations and uses a trend as the best estimate of expected losses.""",,"Disasters such as floods, storms, fires, droughts, heat waves.",Permanent,"This meant, e.g. quarterly annualised CFC fell by 5.8% in Q2 2005, and rose by 18.9% Q3 (associated with Hurricanes Katrina and Rita). Recommendation here is different; proposal is to include the trend. • Practical ‘benefit’ that this doesn’t introduction volatility • Theoretically could be seen as a good proxy for expected costs.",,The National Oceanic and Atmospheric Administration (NOAA) has collected data back to 1980 on US weather and climate disasters,,"The National Oceanic and Atmospheric Administration (NOAA) has collected data back to 1980 on US weather and climate disasters"", ""Based mainly on government and private insurance data (extrapolated to cover uninsured claims)"", ""BEA also measures disaster data",Transitional (accounting for changes over time),"The asset costs of natural disasters in the United States grew rapidly from 1980 to 2023, with the trend rising 4.9% annually in real terms to $90 billion in 2023.",,"The provided material does not mention tipping points or other notable climate complexities. It focuses on the economic impact of disasters, data collection, and methodologies for estimating disaster costs.","Adaptation is not directly addressed in the provided notes, but the focus on using trends and expectations instead of immediate disaster costs may implicitly consider adaptation by aiming to smooth out volatility in economic metrics, potentially reflecting a systematic approach to managing increased frequency of extreme events over time.","""The trend for asset damage from weather and climate disasters should be included in consumption of capital rather than Other Changes in the Volume of Assets."" ""Recommendation here is different; proposal is to include the trend. • Practical ‘benefit’ that this doesn’t introduction volatility • Theoretically could be seen as a good proxy for expected costs."" ""Extreme weather events are more frequent (more “normal”) and likely to become more so."""
