DOI,Author(s),Year,Paper Title,Link to paper,Paper ID,Reviewer,Status,Country(ies),Outcome(s) of Interest,Drivers of Risk,Scenario(s),Methodology,Highlights,More Notes,Applicability,Calibration Approach,Hazard definition,Impact persistence,Space disaggregation,Impact interactions,Economic dynamics,Climate features,Adaptation considered,Impacted Sector,Benefits of Adaptation,Costs of Adaptation,Ante/Post?,Planning Process,"""Soft Options""",Sufficiency Definition,Soft Options
10.3390/ijerph8124386,Trærup S.L.M. et al.,2011,The costs of climate change: A study of cholera in Tanzania,found,10.3390/ijerph8124386,AI,Step 5,"Tanzania, Peru, Fiji","GDP effects, cholera costs (climate change attributable), Tanzania, productivity losses, value of statistical life (VOSL), morbidity, mortality, adaptation costs (preventive and reactive), waterborne diseases (Sub-Saharan Africa), diarrheal diseases.","Climate change; Temperature increase; Rainfall changes (intensity, patterns, drought); Cholera incidence/prevalence; Diarrheal diseases; East Africa; Tanzania; Socioeconomic factors; Adaptation measures (insufficient).",Baseline scenario (C0) based on Mathers and Loncar [35] projections (including diarrheal disease estimates based on correlations between economic growth and mortality trends). Also uses lower and upper boundary projections based on different assumptions about the relative risk increase with temperature.,"The methodology involves a case study approach centered on Tanzania, integrating historical data on temperature, rainfall, and cholera cases, while controlling for socioeconomic factors. It projects the future burden and costs of climate change-attributable cholera cases by 2030. Using historical data, the relationship between climate variables and cholera is estimated, and a health impact assessment is proposed. A baseline scenario is established using existing projections and correlations. Regression models, chosen for their fit and significance, assess the impact of climate and socioeconomic factors on cholera incidence. Reactive adaptation costs and productivity losses are calculated, with cost estimates adjusted for Tanzania's GDP. Analyses incorporate seasonality through dummy variables and use both annual and monthly datasets to project future boundaries of risk. Long-term datasets and unpublished data inform cost estimates, while the adaptation costs in the health sector consider future economic development and health system strengthening. Econometric analyses include negative binomial regression models to describe the relationship between cholera deaths and influencing factors, utilizing datasets on income and water coverage.","Climate change is projected to significantly increase the burden of cholera in Tanzania, potentially costing between 0.32% and 1.4% of GDP by 2030. A 2°C temperature increase could lead to substantial increases in cholera cases and deaths, with the majority (90%) of costs attributed to loss of life. The study estimates additional costs from reactive adaptation measures and productivity losses due to climate change induced cholera, and highlights the positive correlation between temperature and cholera cases. Implementing adaptation measures that limit temperature increase could yield cost reductions of 44-47%. The cost estimates exceed current diarrheal disease budgets, underscoring the need for increased budgetary allocation. Socioeconomic development and water cover are negatively correlated with cholera deaths.","A 2011 study focusing on Tanzania examines the economic costs of climate change, specifically cholera incidence, within the health sector. It aims to inform adaptation financing and planning but acknowledges limited econometric reliability due to short datasets. The analysis models cholera costs, considering lost productivity (including caretaking) using agricultural wages as a proxy. Preventive adaptation costs (assumed aligned with national development goals of universal water and sanitation by 2025) are excluded, focusing on reactive adaptation costs and residual impacts. The study acknowledges focusing narrowly on cholera, potentially underestimating overall health costs of climate change by excluding other climate-sensitive diseases. The distributional impacts of adaptation are not considered. The study emphasizes the need for national and local quantification of climate-sensitive disease burdens and refinement of preventative and reactive adaptation cost estimates within the health sector. The time-trend variable is included to capture socioeconomic variables.",Macroeconomic/Fiscal,Econometric,Acute shocks,Adaptive,,Sequential Interactions,Transitional (accounting for changes over time),,"Reactive adaptation costs are calculated based on the number of climate change-attributable cholera cases and the unit cost per case treated. A future baseline disease burden is incorporated, implying a reduction in incidence rates due to economic growth and health sector developments. The cost estimation is based on VOSL and projected cholera deaths. Strengthening of the health system is considered. Water and sanitation coverage is included in projections of disease.",,,,,,,,
10.1098/rstb.2010.0180,Godfray H.C.J. et al.,2010,The future of the global food system,https://core.ac.uk/download/pdf/9064340.pdf,10.1098/rstb.2010.0180,AI,Step 5,,,,,,,,,,,,,,,,,,,,,,,,
10.1111/j.1365-2486.2009.01997.x,Doherty R.M. et al.,2010,"Implications of future climate and atmospheric CO2 content for regional biogeochemistry, biogeography and ecosystem services across East Africa",https://clip.msu.edu/publications/ruthdoherty.pdf,10.1111/j.1365-2486.2009.01997.x,AI,Step 5,,,,,,,,,,,,,,,,,,,,,,,,
10.1016/j.envsci.2008.11.001,Fresco L.O.,2009,Challenges for food system adaptation today and tomorrow,https://louiseofresco.com/wordpress/wp-content/uploads/2022/01/2009_01_04_Elsevier_Challenges_for_food_system_adaptation_today_and_tomorrow.pdf,10.1016/j.envsci.2008.11.001,AI,Step 5,,,,,,,,,,,,,,,,,,,,,,,,
10.1007/s00114-008-0468-7,Fuhrer J.,2009,Ozone risk for crops and pastures in present and future climates,http://kfrserver.natur.cuni.cz/global/pdf/3_B_FUHRER_ozone_crops_climate.pdf,10.1007/s00114-008-0468-7,AI,Step 5,,,,,,,,,,,,,,,,,,,,,,,,
10.1007/s10584-007-9249-0,Challinor A. et al.,2007,Assessing the vulnerability of food crop systems in Africa to climate change,https://pdfs.semanticscholar.org/f125/952c2ab1f2baed475ebcc79f3cf1c7a63fb6.pdf,10.1007/s10584-007-9249-0,AI,Step 5,,,,,,,,,,,,,,,,,,,,,,,,
10.1073/pnas.0701825104,Naylor R.L. et al.,2007,Assessing risks of climate variability and climate change for Indonesian rice agriculture,https://atmos.washington.edu/~david/Naylor_etal_2007.pdf,10.1073/pnas.0701825104,AI,Step 5,,,,,,,,,,,,,,,,,,,,,,,,
10.1016/j.strueco.2023.05.009,Chang et al.,2023,Temperature and GDP: A review of climate econometrics analysis,found,10.1016/j.strueco.2023.05.009,AI,Step 5,,,,,,,,,,,,,,,,,,,,,,,,
10.1175/BAMS-D-21-0262.1,Brunet et al.,2023,Advancing Weather and Climate Forecasting for Our Changing World,found,10.1175/BAMS-D-21-0262.1,AI,Step 5,,,,,,,,,,,,,,,,,,,,,,,,
10.1038/s43247-023-01173-x,Kotz et al.,2024,Global warming and heat extremes to enhance inflationary pressures,found,10.1038/s43247-023-01173-x,AI,Step 5,121 countries,"Inflation (food, headline, national); Upward pressure; Temperature sensitivity.","Temperature increases (average, monthly, seasonality), temperature variability, extreme heat/heatwaves, extreme precipitation, droughts (SPEI), anthropogenic greenhouse gas emissions, climate change projections (SSPs, CMIP-6), weather shocks (temperature, precipitation).","SSP585, SSP126","The study employs fixed-effects panel regressions using historical monthly inflation and weather data (primarily 1996-2021, with some analyses extending to 1990-2021) across 121 countries, controlling for country-specific time trends and seasonality. It projects future inflation impacts by combining empirically derived response functions with climate model (CMIP-6 ensemble) projections of future temperature, using different Shared Socioeconomic Pathways (SSPs) like SSP585 and SSP126. The analysis focuses on average temperature increases and often considers the exogenous pressure on inflation, assuming no unprecedented adaptation or policy responses and abstracting from macroeconomic interactions. Robustness tests include dynamic panel specifications, Driscoll-Kraay standard errors, and controls for monetary policy. Some analyses incorporate lagged weather variables and downscaling methods (ISIMIP). Spatial aggregation is often performed using population-weighted averages. Future impacts are sometimes averaged over 30-year periods.","Persistent temperature increases affect both food and headline inflation across different income countries, with intensified pressures in low latitudes and seasonal peaks in high latitudes. Impacts of temperature rises are nonlinear and keenly felt in food prices, with climate variability exacerbating these effects. Global warming elevates inflation risks significantly, independent of emission trajectories, though mitigation efforts could alleviate these pressures. Future warming will disrupt traditional seasonal inflation cycles and intensify inflation impacts, with climate extremes potentially increasing inflationary pressures by up to 200% by 2060 under pessimistic scenarios. Climate change is anticipated to heighten inflation volatility and enforce ongoing upward pressure on inflation levels. Inconsistencies in data, such as the inclusion of imputed rents, affect inflation responses. Weather deviations alter month-on-month inflation, with linear trend adjustments clarifying effect sizes. Extreme weather conditions, such as the 2022 European summer heatwave, provide insights into potential future impacts of warming on inflation.","Climate change impacts on inflation are non-linear, varying across seasons, regions, and latitudes, with hotter regions and months experiencing larger effects. Temperature increases at lower latitudes cause upwards inflationary pressures year-round, while at higher latitudes, the effect is seasonal. The magnitude of inflationary pressure from future warming is projected to be greater in the global south. These impacts depend on baseline temperatures and climatic conditions, implying that future climate change will amplify inflation heterogeneity and alter seasonality. While the study also considers precipitation extremes, detecting impacts on food prices is limited by data constraints. Inflationary impacts could be mitigated through adaptation measures like reducing heat stress on labor productivity and crop switching. The analysis considers temperature shocks defined by static and moving baselines. Uncertainty in estimates arises from empirical specification, climate model projections, and emission scenarios. GADM database is used for national administrative boundaries.",Macroeconomic/Fiscal,Econometric,Chronic trends,Adaptive,Global,,Transitional (accounting for changes over time),,"Analysis considers impacts in the absence of historically unprecedented adaptation, policy response, and macroeconomic interactions. Estimates reflect exogenous pressures on inflation arising from future weather conditions. Empirical results are estimated using monthly temperatures, and future summer warming is projected using CMIP-6 models. Impacts are estimated accounting only for increasing average temperatures.",,,,,,,,
10.1016/j.wace.2021.100309,Mori et al.,2021,Recent nationwide climate change impact assessments of natural hazards in Japan and East Asia,found,10.1016/j.wace.2021.100309,AI,Step 5,Japan and East Asia,Economic impacts; Flood damage costs; Scenario-based impact assessments; Policy mitigation value; Expected loss reduction; Risk premium; Ambiguity premium; Mitigation/adaptation costs; Social damage; Economic damage.,Climate change; extreme rainfall; typhoons/tropical cyclones; sea level rise; storm surge; increased frequency/intensity; Baiu season; guerrilla-heavy rainfall; river flooding; coastal hazards; warmer climate conditions; atmospheric destabilization.,"MRI-AGCM 3.2S, NHRCM05, PGW (pseudo-global warming) experiments, d4PDF (database for Policy Decision-making for Future climate change), GHGE (GreenHouse Gas Emission) scenarios.","The study uses a multi-faceted approach to assess climate change impacts and adaptation benefits, primarily focused on Japan and East Asia. The methodology involves: (1) Downscaling global climate models (GCMs) using regional climate models (RCMs) and pseudo-global warming (PGW) experiments, including the MRI-AGCM 3.2S and NHRCM05 models; (2) Utilizing the d4PDF dataset (database for Policy Decision-making for Future climate change), a large ensemble of climate projections, to analyze changes in extreme rainfall, wind speeds, and storm surges; (3) Employing hydrological models (O(100 m) resolution) to project flood risk and comparing rainfall distributions with the Kolmogorov-Smirnov (K-S) test; (4) Constructing flood risk curves based on historical and future climate scenarios; (5) Applying the Global Stochastic Tropical Cyclone Model and the SUWAT (surge-wave-tide) model to simulate tropical cyclones and predict storm surges, creating probability distribution functions (PDFs) of flood risk; (6) Implementing a web-based survey with a Limited Degree of Confidence (LDC) model to estimate public preferences on risk and ambiguity related to storm surges; and (7) Emphasizing the importance of bias correction of climate projections. The framework includes climate projection (GCMs/RCMs), hazard projection, and impact assessment to evaluate social and economic damages.","Projected climate change in Japan (RCP8.5) indicates increased frequency and intensity of extreme rainfall events, driven by thermodynamic and dynamic effects, leading to significantly increased flood risk in major river basins and higher probabilities of exceeding high flood damage costs (e.g., 800 billion JPY). Storm surge severity is expected to increase within 15-35°N, particularly in East Asia, with changes dependent on return periods. Risk and uncertainty premiums associated with flood damage are substantial and unevenly distributed, highlighting their importance in evaluating mitigation policies. Future conditions suggest increased expected loss reductions, risk premiums, and uncertainty premiums, indicating a greater financial burden from coastal hazards. Overall, increased rainfall and typhoons will cause increases in extreme storms, river discharge, coastal surges, and changes to water resources.","Researchers characterize and quantify changes in extreme rainfall events, identifying events from NHRCM05 precipitation output with a threshold of 50 mm/h. Simulated discharge biases were unexamined due to limited observed data. The Yodo River basin in Osaka Bay, Japan, serves as a case study for flood risk, with a long tail in the exceedance probability histogram showing extreme rainfall impact. Northern Japan exhibits varied impacts compared to the Pacific-facing south. The importance of combining methodologies (d4PDF and PGW) and applying bias correction for climate projections is emphasized for adaptation planning, focusing on climate-related hazards in Japan.",Adaptation,,,,,,,,,"The paper highlights that the specific sectors of the economy impacted by climate change include those affected by natural hazards such as extreme rainfall, floods, and storm surges. In particular, the study focuses on sectors related to hydrological and meteorological impacts, with detailed analysis on flood and storm surge risks, especially in regions like the Yodo River basin and Osaka Bay in Japan. These climate-related hazards have implications for infrastructure, economic damages, and mitigation policy evaluations.","Benefits of adaptation are quantified by projecting future climate hazards using climate models and statistical analysis of rainfall, wind speeds, and storm surges. These projections are then used to model flood risks and other climate-related damages, allowing for the estimation of economic value of adaptation policies (e.g., dike construction). Risk preferences are also incorporated using surveys.","Costs of adaptation are quantified by using climate projections (GCMs, RCMs, d4PDF, PGW experiments) to assess future climate-related hazards, followed by impact assessments that evaluate social and economic damages and estimate the benefits of specific adaptation measures (e.g., dike rise) in reducing risk (e.g., storm surge flood risk). These assessments often involve statistical analysis, hydrological modeling, and risk preference surveys.","The analysis relies primarily on ex-ante modeling. The notes describe the use of climate models, such as downscaled global climate models, regional climate models, and ensemble projections like the d4PDF and PGW experiments, to project future climate impacts, including rainfall patterns, flood risks, and storm surge scenarios. These projections are based on simulations and scenarios, such as historical and future SST rise, rather than on ex-post observations.","The reviewed studies primarily focus on using climate projections (d4PDF, PGW experiments, GCMs, RCMs) to assess climate-related hazards (rainfall, floods, wind speeds, storm surges) and their potential impacts. The adaptation planning/decision-making process is touched upon by evaluating mitigation policies based on public preferences regarding risk and ambiguity (storm surge risk, dike rise mitigation policy) and estimating the economic value of these policies. The need for bias correction in climate projections is also noted.",,"This paper focuses on projecting climate change impacts and assessing mitigation policies, particularly related to extreme rainfall, floods, and storm surges in Japan. It does not directly define ""sufficient adaptation levels"" but implicitly suggests adaptation involves reducing the probability of exceeding specific flood damage levels, mitigating storm surge risk, and implementing policies like dike rises. Therefore, being ""well-adapted"" in this context means reducing the risks associated with these hazards to acceptable levels based on risk assessments and public preferences.","The provided excerpts do not contain information about the benefits of ""soft options"" like informational and institutional interventions. The focus is on climate modeling, risk assessment, and evaluating hard infrastructure solutions."
10.3390/econometrics9020024,Ahumada & Cornejo,2021,Are Soybean Yields Getting a Free Ride from Climate Change? Evidence from Argentine Time Series Data,https://pdfs.semanticscholar.org/334b/70dd65b1cc8432f981748149cf7f63a3ec15.pdf,10.3390/econometrics9020024,AI,Step 5,,,,,,,,,,,,,,,,,,,,,,,,
10.3390/en14144189,Peng et al.,2021,Heterogeneous Impacts of Extreme Climate Risks on Global Energy Consumption Transition: An International Comparative Study,found,10.3390/en14144189,AI,Step 5,101 countries/regions,Energy consumption transition; renewable energy adoption; fossil fuel reduction; energy consumption structure; impact assessment.,"Extreme climate risks, Global Climate Risk Index (GCRI), energy consumption, socio-economic impacts, short-term/long-term climate risks, governance quality, GDP per capita, urbanization, industrialization, trade openness, fossil energy resources, economic development, business cycle fluctuations, oil price fluctuations","Varying economic cycle (boom/recession), oil price trends (rise/fall), GDP per capita (high/low), median fossil energy production (resource-rich/poor).","Methodology: The study employs panel data analysis of 101 countries/regions from 2006-2019 using fixed-effects models (country and year). Spatial panel models are also considered. An instrumental variable approach using coastline length addresses endogeneity via two-stage least squares regression. Stability is assessed via augmented Dickey-Fuller tests. Sub-sample regressions based on fossil energy production, economic development level, GDP per capita, economic cycle, and oil price trends are performed. Hausman test validates the fixed-effects specification.","Climate risk, particularly long-term risk, drives a transition in energy consumption away from fossil fuels and towards renewable energy. This effect is moderated by governance quality, which can weaken the transition. The impact of climate risk on energy transition is more pronounced in resource-rich and low-income countries, during economic recessions, and when oil prices are falling; high-income countries do not show the same positive correlation. Areas with strong economies and coastal locations display greater inclination to respond through transition.","Germanwatch's Climate Risk Index is employed, with lagged climate risk variables used in analysis. Control variables include GDP per capita, urbanization, industrialization, and trade. Better governance is theorized to foster proactive energy policies. Data includes coastline length from ChartsBin. Resource-rich/poor status is determined by median fossil energy production. Economic booms may compensate for climate risk losses, while recessions can spur renewable energy consumption via industrial policies and environmental regulations.",Macroeconomic/Fiscal,Econometric,,,Global,,Transitional (accounting for changes over time),,"The analysis focuses on the impact of climate risk on energy consumption transition. Statistical methods include panel data models with fixed effects, spatial panel models, instrumental variable techniques to address endogeneity, and sub-sample regressions based on various economic and resource-related factors. Governance quality's moderating effect is examined.",,,,,,,,
