DOI,Author(s),Year,Paper Title,Link to paper,Paper ID,Reviewer,Status,Country(ies),Outcome(s) of Interest,Drivers of Risk,Scenario(s),Methodology,Highlights,More Notes,Applicability,Calibration Approach,Hazard definition,Impact persistence,Space disaggregation,Impact interactions,Economic dynamics,Climate features,Adaptation considered,Impacted Sector,Benefits of Adaptation,Costs of Adaptation,Ante/Post?,Planning Process,"""Soft Options""",Sufficiency Definition,Soft Options
10.5194/hess-20-4143-2016,Hanasaki N. et al.,2016,A seawater desalination scheme for global hydrological models,https://hess.copernicus.org/articles/20/4143/2016/hess-20-4143-2016.pdf,10.5194/hess-20-4143-2016,AI,Step 5,Global (186 plants globally),"GDP impacts, adaptation costs (desalination), desalination as adaptation measure, energy prices influencing affordability.","Drivers of Risk: Population growth, economic growth, climate change, water demand, income growth (desalination), GDP per capita threshold, aridity index, water scarcity (influenced by SSPs), projected water resource decrease.","SSP1, SSP2, and SSP3","The study projects the spread of seawater desalination using a Seawater Desalination Model (SDM) under different Shared Socioeconomic Pathways (SSPs), incorporating global hydrological models. The SDM estimates desalination needs based on GDP per capita and aridity index thresholds, with unit production costs estimated at 0.40–3.78 USD m−3. The model is applied to historical (2005) and future periods (2011–2040 and 2041–2070) to project desalination needs until 2055 under various socioeconomic scenarios.","Global desalination production is projected to increase substantially, particularly in arid regions like MENA, driven by population growth and declining water availability. While globally a small portion of total water consumption, desalination's economic impact in regions with low GDP growth could be significant. The extent of desalination expansion and its cost are sensitive to socioeconomic pathways (SSPs), GDP per capita, and aridity, with income and aridity serving as key thresholds for desalination plant installation. Arid and semi-arid regions are expected to rely heavily on it.","Desalination model development involved addressing limitations related to regional applicability and thresholds for GDP, aridity, and coastal proximity. The analysis focuses on supply-side adaptation through desalination and uses SSPs to explore future socioeconomic pathways. Uncertainties remain regarding regional variations and the impact of technological advancements on costs.",Adaptation,,,,,,,,,"The paper focuses on the water sector, specifically the impact of climate change and socioeconomic conditions on seawater desalination needs and production.","The provided excerpt does not directly address the quantification of *benefits* of adaptation. Instead, it focuses on a model (SDM) to project the *costs* and *spread* of seawater desalination under different scenarios, based on factors like GDP per capita, aridity, and unit production costs (0.40-3.78 USD m-3). The study uses GHMs and SSPs to estimate future water demand and desalination production, applicable for projections until 2055.","The costs of adaptation, in this specific case relating to seawater desalination, are quantified by estimating the unit production costs (0.40-3.78 USD m−3) and multiplying that by the projected spread and volume of seawater desalination needed under different socioeconomic pathways. Desalination needs are estimated using a model incorporating GDP per capita, aridity index thresholds, global hydrological models, and socioeconomic pathways.","The analysis primarily relies on ex-ante modeling, projecting future desalination needs and production based on socioeconomic pathways and global hydrological models. While historical data is used to inform cost estimations, the core analysis forecasts future scenarios.","The paper focuses on modeling and projecting seawater desalination needs under different socioeconomic scenarios to 2055, using global hydrological models, socioeconomic pathways (SSPs), and a Seawater Desalination Model (SDM). The SDM estimates desalination needs based on income and aridity assumptions. It does not explicitly discuss the broader adaptation planning/decision-making process, but provides a modeling tool to inform decisions related to water resource management in the face of climate change.","No information on ""soft options"" or their benefits is present in the provided text extracts.","This paper doesn't explicitly define ""sufficient adaptation levels"" or what it means to be ""well-adapted"" in a general sense. Instead, it implicitly frames adaptation in the context of water scarcity, focusing on seawater desalination as an adaptation strategy. Sufficient adaptation, in this context, would likely be determined by the ability of desalination to meet projected water demand under different socioeconomic and climate scenarios (SSPs) and to do so at reasonable costs relative to GDP per capita. The model estimates desalination needs based on these income and aridity factors.",
10.1038/nclimate2837,Huang J. et al.,2016,Accelerated dryland expansion under climate change,https://hjp.lzu.edu.cn/upload/news/N20180925142954.pdf,10.1038/nclimate2837,AI,Step 5,,,,,,,,,,,,,,,,,,,,,,,,
10.1016/j.euroecorev.2020.103409,Gallic & Vermandel,2020,Weather shocks,https://amu.hal.science/hal-02498669/document,10.1016/j.euroecorev.2020.103409,AI,Step 5,New Zealand,"GDP, agricultural production, consumption, investment, hours worked, real exchange rate, trade balance, net foreign assets, welfare costs (consumption equivalent/willingness to pay), productivity (land), business cycles, output gap.",Weather shocks; Droughts; Soil moisture; Climate change (variance of events); Damage function (temperature impact on output); Technological shocks; Public spending shocks; Foreign shocks.,IPCC's climate change projections for 2100; Different climate scenarios with altered weather shock variability; Representative Concentration Pathways (RCPs) for projected precipitation.,"The study employs a two-pronged methodological approach to assess the macroeconomic impacts of weather shocks, focusing on New Zealand. First, a Structural Vector Auto-Regressive (SVAR) model is used to document the transmission mechanisms of weather shocks, using a soil moisture-based weather index. Restrictions are imposed to reflect New Zealand's small open economy and exogenous weather. A lower triangular Choleski decomposition is used to derive orthogonal impulse responses. The SVAR model is further used for Monte-Carlo simulations to model the effects of weather shocks. Second, a Dynamic Stochastic General Equilibrium (DSGE) model, incorporating a weather-dependent agricultural sector and time-varying land productivity, is estimated using Bayesian techniques and quarterly data. The agricultural sector employs a Cobb-Douglas production function, and weather is treated as an exogenous AR(1) process. The model is solved using a first-order approximation to the policy function and estimated using the dynare package and the Metropolis-Hastings algorithm. Bayesian model comparison and posterior odds ratios are used to compare the DSGE model with alternative specifications, including one without weather damage and the SVAR. The model is estimated using New Zealand data, with variables transformed for stationarity. Prior distributions are specified for various parameters, adapted from previous studies. The estimated model is then used for simulations, including counterfactual analyses based on IPCC climate change projections for 2100, modifying weather shock variances. Impulse response functions (IRFs) are generated to analyze short-run and long-run impacts, and variance decomposition is performed to assess the contribution of different shocks. Welfare costs are computed using a second-order approximation to the welfare index, estimating the fraction of consumption households would be willing to give up to live in an economy free of weather shocks. Business cycle moments are compared to their empirical counterparts, and historical decompositions are performed.","Weather shocks have a substantial impact on New Zealand's macroeconomic variables, particularly GDP and agricultural output, and their effects are intensified by climate change, which increases macroeconomic volatility and welfare costs. The study proposes a quantitative framework to evaluate weather shocks' influence on business cycles, emphasizing their significance for agriculture-driven economies. Severe droughts have historically disrupted New Zealand's economy, causing declines in agricultural production and GDP, and affecting sectors like labor and the current account.

Weather shocks are treated as standard negative supply shocks, leading to reductions in agricultural output, consumption, and investment, as well as an increase in hours worked. The resulting recessions from drought shocks demonstrate persistent effects, especially in labor markets. The study introduces weather variables to model soil moisture's effect on production, showing the complexity of adapting to such shocks through mechanisms like irrigation and changes in land maintenance spending.

Model analyses using DSGE and SVAR highlight the macroeconomic fluctuations and the volatility of key variables such as GDP and real exchange rates. Climate change scenarios worsen these fluctuations, with higher welfare costs and non-trivial effects on permanent consumption. The paper also identifies significant co-movements between sectors due to the imperfect substitutability of labor, with the tertiary sector expanding post-drought shocks. The models indicate increasing uncertainty of weather shocks in different climate scenarios and provide insights into the nature of business cycle fluctuations in New Zealand driven by weather events.","The study develops a Dynamic Stochastic General Equilibrium (DSGE) model with a weather-dependent agricultural sector to assess the macroeconomic impacts of climate change, particularly focusing on increased climate variance. The model is calibrated using New Zealand data, treating weather as exogenous and drought indices as autoregressive. Key assumptions include limited human impact on drought occurrence, a short forecast horizon for farmers, no CO2 feedback loop, and hysteresis effects in agricultural production. The model incorporates external consumption habits, aversion, and labor disutility. It replicates observed economic means and volatility, with the parameter θ being potentially critically high. The model's strength lies in its micro-founded mechanisms propagating weather shocks and capturing the role of foreign shocks. Increased weather shock contribution over time suggests persistence via hysteresis. Sensitivity analysis focuses on land expenditure cost (φ) and labor sectoral cost (ι). Scenarios with decreased (optimistic) and increased (pessimistic) weather shock variance are analyzed. The model may underestimate climate change impacts in developing economies. The framework could be used to evaluate monetary and fiscal policy responses to weather shocks. Results are presented as impulse response functions (IRFs) from the steady state for an unspecified country. The study aims to match observed economic behavior, linking agricultural output and weather to potential climate impacts.",Macroeconomic/Fiscal,,Acute shocks,Adaptive,,Sectoral Interactions,Transitional (accounting for changes over time),,"Time-varying land productivity is incorporated, affected by drought and farmer expenditures (pesticides, irrigation). Endogenous land productivity evolution modeled, with the marginal product of land increasing in land productivity accumulation. Farmers' reactions aren't directly modeled. Changes in land expenditure cost are considered.",,,,,,,,
10.3389/fsufs.2023.1159901,Gbegbelegbe S. et al.,2023,Strategic Foresight analysis of droughts in southern Africa and implications for food security,found,10.3389/fsufs.2023.1159901,AI,Step 5,"Southern Africa, Malawi, Zimbabwe, Zambia","Food security (number and share of population at risk of hunger), food prices, agricultural production (crop yield, acreage, producer price, total production, production indices for maize, cowpea, cassava, soybean, groundnut, bean, rice, pigeon pea, cotton, tobacco), maize consumption, purchasing power, drought impacts.",Drought; Southern Africa; Regional; Recurrent; Consecutive (two-year); Crop Production; Food Security; Agricultural Income; Population Growth; Income Growth; Relative Price Changes; Maize; Trade Volatility; Policy Response.,"Moderate economic growth, no drought, and drought scenarios.","The study employs a bio-economic modeling approach, utilizing an adjusted version of the International Model for the Policy Analysis of Agricultural Commodities and Trade (IMPACT 3.2) to project the impact of future droughts on food security in Southern Africa to 2040. The model simulates agricultural production, consumption, and trade, considering factors like crop yields, water availability, population and income growth. Drought effects are incorporated as exogenous shocks to crop yields and/or acreage, and drought frequency data from 2000-2016 is used to project future drought occurrences. The model is validated against FAOSTAT data. Authors' computations use the results from IMPACT 3.2 to project various impacts of drought. Food security estimation utilizes equations and coefficients from Fischer et al. (2005). Crop yield penalties and food price changes are calculated using FAOSTAT (2018) data, while food insecurity rates are derived from Southern African Development Community (2016) and World Bank (2018) data.","Recurrent droughts in Southern Africa are projected to severely impact food security by 2040, primarily through reduced maize production. Most countries will likely experience a substantial increase in the number of people at risk of hunger, becoming more import-dependent for staple foods. While drought impacts vary by crop and country (with some crops like tobacco potentially benefiting in certain regions), overall crop production indices decline under drought scenarios. Diversification away from maize and promotion of drought-tolerant crops like cowpea and cassava are suggested as potential adaptation strategies to enhance food security. Model projections indicate increasing risk of food insecurity between 2024 and 2040, with the peak impact expected between 2028 and 2032.","The study assesses the impact of droughts on food security in Southern Africa, using the IMPACT 3.2 model and focusing on specific drought years (e.g., June 2016 after two drought years). It highlights the varying vulnerability of countries based on crop specializations and drought severity, noting South Africa's crucial role as a maize producer and exporter. The model captures observed price effects, reflecting policy responses, and distinguishes between traded and non-traded commodities. While the model validates against past data, it primarily assesses agricultural production levels, not direct macroeconomic or fiscal impacts, and may underestimate indirect drought effects on food security by not incorporating industrial and service sector impacts. Adaptation strategies identified include breeding stress-resilient maize, promoting crop and diet diversification, and investing in rainwater harvesting. Observed farmer behavior suggests varying adaptation capacity across countries, such as Malawi versus Zambia.",Macroeconomic/Fiscal,,Acute shocks,Adaptive,Regional,Sectoral Interactions,Transitional (accounting for changes over time),,"Drought effects are incorporated as exogenous shocks to crop yields and/or acreage within the IMPACT model. The model projects agricultural production, consumption, and trade, considering crop yields, irrigated water availability, population and income growth. The analysis contrasts scenarios with and without drought to assess implications.",,,,,,,,
10.1016/j.jebo.2024.03.025,Chen et al.,2024,"Weather, credit, and economic fluctuations: Evidence from China",found,10.1016/j.jebo.2024.03.025,AI,Step 5,China,"GDP, CPI inflation, Interest rates, Credit to non-financial firms (macro);
Firm-level output/value-added, access to bank loans (loan/asset ratio), credit risk/default probability, ROA, interest expenses (micro);
Household consumption;
Asset values.","Extreme weather events/shocks (various types, ACI index), economic uncertainty, monetary policy, financial stress, leverage, government debt, firm characteristics (age, assets, sales), credit conditions, temperature shocks.","Counterfactual analysis (with and without monetary policy interventions) based on an Aggregate Climate Index (ACI) constructed from 1990-2020 using Chinese meteorological data. The ACI components include extreme high and low temperatures, concentrated precipitation, drought, and strong wind. Some alternative base periods (1960-1989) and treatments of extremely low temperatures are also used. A placebo test is also conducted by randomly assigning the ACI index across time.","The analysis employs a combination of macroeconomic and microeconomic methods. At the aggregate level, a five-variable Structural Vector Autoregression (SVAR) model is used, incorporating a Chinese Aggregate Climate Index (ACI), GDP, CPI, interest rate, and total credit, spanning from 2001 Q1 to 2020 Q4. Cholesky decomposition is used to identify weather shocks, and impulse response functions and variance decompositions are performed. Counterfactual analysis is also employed to assess the impact of monetary policy responses. At the firm level, panel regression analysis with firm and time fixed effects is conducted, typically using Chinese listed companies between 2006 Q1 and 2020 Q4. These regressions explore the impact of the ACI (often lagged) on variables such as bank loans, value added, expected default frequency (EDF), and analyst ratings, considering moderating factors like economic policy uncertainty, financial stress, leverage, and local government debt. Robustness checks include placebo tests using resampled ACI data, alternative ACI constructions, and exclusion of data from crisis periods (2008-2009, 2020).","Extreme weather shocks have persistent negative effects on GDP, credit access, and firm-level output. These shocks cause a rise in expected default risk and decrease loans obtained by firms, particularly among non-state-owned, younger, and smaller firms. The Aggregate Climate Index (ACI) measures these weather risks and shows increasing trends in recent years. The impacts vary by region, industry, and the firm’s financial health. Essentially, the economic effects are more pronounced in provinces with high economic policy uncertainty and where local government borrowing restricts corporate borrowing. 

Monetary policies are significant in mitigating these adverse effects; otherwise, they exacerbate credit and GDP contractions post weather shocks. High collateral and corporate confidence can moderate these negative impacts. Adverse weather influences output markets with a two-quarter lag but affects credit markets faster. Extreme temperature, droughts, and floods typically reduce bank loan values relative to assets, while strong winds seem to provide a curious positive effect.

Adaptation measures help mitigate some of these effects, particularly regarding household consumption. ACI is linked to significant variance in GDP, CPI, interest rates, and credit, especially in the short term. Financial uncertainties correlate with macroeconomic outcomes, underscoring the importance of reinforcing monetary policies and adapting to rising climate risks.","This study analyzes the macroeconomic and firm-level impacts of weather shocks in China, focusing on listed companies and their credit access. It constructs an Aggregate Climate Index (ACI) using daily meteorological data, incorporating precipitation and drought extremes. The analysis uses panel regressions and SVAR models, controlling for firm-level assets, age, tangible assets, macroeconomic variables, firm fixed effects, and time fixed effects. Extreme weather is shown to impact firms' credit access, value-added, and other financial variables, potentially with a lag. Robustness checks explore alternative ACI specifications (ACI_d, ACI_b, ACI_c) and consider low-temperature extremes as risks. The analysis draws data from the CSMAR database, the National Bureau of Statistics of China, and the China Meteorological Data Service Center, extending to 2020 in some specifications. Future research directions include quantifying economic consequences and exploring monetary/credit policy responses.",Macroeconomic/Fiscal,Econometric,Acute shocks,,,,Transitional (accounting for changes over time),,"Adaptation to climate impacts is assessed through the elaboration of an Aggregate Climate Index (ACI) tailored to capture extreme weather effects on macro-fiscal variables across sectors at the national level. The analysis incorporates firm-level and macroeconomic data through structured policy analysis and counterfactual scenarios, demonstrating monetary policy's adaptive responsiveness. The research employs structural vector autoregression and panel regression techniques to evaluate the economic consequences of climate-related shocks, examining loan dynamics, firm valuation, and broader economic indicators across timeframes, factoring adaptation considerations indirectly through economic adjustments and policy interventions.",,,,,,,,
10.5194/esd-11-697-2020,Geiges A. et al.,2020,Incremental improvements of 2030 targets insufficient to achieve the Paris Agreement goals,,10.5194/esd-11-697-2020,AI,Step 5,"LDCs (Least Developed Countries) and big emitters (unspecified). The study also involves global greenhouse gas emissions and temperature trajectories, suggesting a global scope.","GDP reduction, GDP per capita reduction, Economic damages",NDCs; Emission scenarios; Temperature increase; Global Mean Temperature (GMT); Sea-level rise; Climate impacts; NDC ambition levels.,"NDC reference scenario, 33% ambition increase for big emitters scenario, 1.5◦C scenario.","The study assesses economic damages from climate change using a methodology based on Burke et al. (2018), relating historical GDP growth to temperature variability and projecting future temperature changes. This includes downscaling global mean temperature changes to gridded patterns. The analysis models global emissions and temperature trajectories under different mitigation scenarios, and projects climate impacts like sea-level rise and GDP reductions for LDCs. Different GCMs are used to estimate economic damages, presented as percentage differences in GDP per capita under various temperature pathways relative to a no-climate-change baseline for mid- and end-of-century. The underlying code for the economic analysis is available on GitHub. The model used does not consider sea-level rise, extreme weather, or non-linear trends.","Current Nationally Determined Contributions (NDCs) are insufficient to meet the Paris Agreement goals, leading to significant economic damages, particularly for LDCs, SIDS, South Asia, and Latin America. While incremental improvements to NDCs offer some benefit, a transformational increase in ambition is required to limit warming to 1.5°C and substantially reduce GDP per capita losses. More ambitious mitigation targets for big emitters have the largest impact on global mean temperature. Even significant improvements by major emitters only partially offset the inferred impacts of climate change compared to a 1.5°C scenario, with tropical countries potentially experiencing a 60% GDP reduction under current trajectories relative to a no-climate-change scenario.","The analysis focuses on the aggregate ambition of NDCs, using high CAT pledges as a benchmark, rather than evaluating individual NDC impacts. It examines regional/political groupings like South Asia, Latin America, SIDS, and LDCs, and considers LULUCF activities while acknowledging potential transparency issues.",Macroeconomic/Fiscal,Econometric,Chronic trends,Permanent,Global,,Transitional (accounting for changes over time),,"Adaptation is not explicitly modeled or mentioned. The focus is on mitigation scenarios and the resulting economic damages from climate change impacts (temperature increases, sea-level rise, and GDP reductions for LDCs) under different temperature pathways. The methodology used (Burke et al., 2018) for economic damage calculations does not include sea-level rise, extreme weather, or non-linear trends.",,,,,,,,
