DOI,Author(s),Year,Paper Title,Link to paper,Paper ID,Reviewer,Status,Outcome(s) of Interest,Outcome(s) of Interest-sourcematerial,Drivers of Risk,Drivers of Risk-sourcematerial,Category,Category-sourcematerial,Approach,Approach-sourcematerial,Methodology,Methodology-sourcematerial,Highlights,Highlights-sourcematerial,More Notes,More Notes-sourcematerial,Hazard definition,Hazard definition-sourcematerial,Impact persistence,Impact persistence-sourcematerial,Space disaggregation,Space disaggregation-sourcematerial,Impact interactions,Impact interactions-sourcematerial,Economic dynamics,Economic dynamics-sourcematerial,Climate features,Climate features-sourcematerial,Adaptation considered,Adaptation considered-sourcematerial
10.1007/s00148-024-01039-2,Huang & Hong,2024,The impact of global warming on obesity,http://www.ccap.pku.edu.cn/docs/2025-01/20250109102110465468.pdf,10.1007/s00148-024-01039-2,AI,Step 6,"Increased obesity rates (temperate zones), decreased obesity rates (some tropical countries), worldwide increase of 79.7 million obese adults (12.3%) per 1°C temperature increase.","""we find that global warming has significantly increased obesity rates in countries located in temperate zones, while only causing a reduction in a small number of tropical countries. The estimates suggest that a 1 degrees\documentclass[12pt]{minimal} \usepackage{amsmath} \usepackage{wasysym} \usepackage{amsfonts} \usepackage{amssymb} \usepackage{amsbsy} \usepackage{mathrsfs} \usepackage{upgreek} \setlength{\oddsidemargin}{-69pt} \begin{document}$$<^>{\circ }$$\end{document}C increase in the annual mean temperature would result in a worldwide increase in obese adults of 79.7 million, or 12.3%.""","Global warming, annual mean temperature, temperature fluctuations, temperature bins, seasonal mean temperature, temperature variation, temperature shocks, long-term temperature trends, positive temperature shocks, emissions scenarios (SSP1-1.9, SSP2-4.5, SSP5-8.5), temperature increases in high-temperature seasons.","""Year-to-year temperature fluctuations and increases in annual mean temperature are identified as drivers impacting obesity."" ""The key climate variable is annual mean temperature. Other temperature measures include temperature bins, seasonal mean temperature, temperature variation, and temperature shocks."" ""Climate projections are based on three emissions scenarios: SSP1-1.9 (low), SSP2-4.5 (intermediate), and SSP5-8.5 (high)."" ""Temperature fluctuations are examined as a shock impacting obesity outcomes."" ""Temperature, specifically year-to-year temperature fluctuations and long-term temperature trends."" ""Temperature bins and seasonal mean temperature are drivers of risk."" ""Increases in temperature during high-temperature seasons (seasons 3 and 4); within-year temperature variation"" ""Positive temperature shocks, defined as months where temperature exceeds one standard deviation above the long-run average for that month."" ""Annual mean temperature (°C), ranging from -10 to 35.""",Health > Other,"Page 1: Source material: ""This study identifies obesity as an important channel through which global warming affects human capital. By analyzing plausibly exogenous year-to-year temperature fluctuations in 152 countries from 1975 to 2016, we find that global warming has significantly increased obesity rates in countries located in temperate zones, while only causing a reduction in a small number of tropical countries. The estimates suggest that a 1°C increase in the annual mean temperature would result in a worldwide increase in obese adults of 79.7 million, or 12.3%.""",Econometric,"The study employs a panel model using data from 1975 to 2016 for 152 countries, relying on year-to-year temperature fluctuations to identify the causal effect of warming on obesity. The baseline model utilizes a third-degree temperature polynomial to account for the nonlinear impact of temperature on obesity; 'long-difference' model relies on long-term temperature trends to identify the impact. The analysis uses a fixed effects panel model, comparing the same country over time to estimate the causal effect of warming. It relies on inter-annual temperature fluctuations being random. The baseline model uses eight control variables: log GDP per capita and its square, annual total precipitation and its square, wet day frequency, frost day frequency, cloud cover percentage, and vapor pressure. The analysis examines the impact of warming on obesity using geographic region exclusion and alternative temperature measures like 3°C bins for country-level analysis. Utilizes multi-model ensemble climate projections from CMIP6 for scenario analysis. The analysis uses models (9) and (10) and clusters standard errors at the country level. Seasonal definitions are based on ranking of monthly mean temperatures. The analysis uses a seasonal model with country fixed effects to analyze the effect of temperature increases in different seasons on obesity rates. They also examine the effect of within-year temperature variation on obesity, using a third-degree polynomial of temperature variation in a modified baseline model. The evaluation of obesity rates is detailed as follows: ""Response function of obesity to temperature variation"" and ""impact of positive temperature shocks on obesity"". The drivers of risk from positive temperature shocks are described through ""positive temperature shocks"" defined as ""months where the temperature exceeds one standard deviation above the long-run average temperature for that month."" Quantitative information is gathered through using ""a modified version of the baseline model"" and referencing ""the third-degree polynomial of the positive temperature shock"" and over the past 30 years. The analysis highlights that ""positive temperature shocks initially enhance and then reduce the adult obesity rate,"" consistent with patterns observed in the baseline model.","The study examines the impact of global warming on obesity rates using a fixed effects panel model applied to data from 152 countries from 1975 to 2016. It employs plausibly exogenous year-to-year temperature fluctuations to identify causal effects. The baseline model employs a third-degree temperature polynomial to capture nonlinear impacts, while a 'long-difference' model captures long-term effects. The study uses population-weighted climate measures and ensemble climate projections (CMIP6). Key climate variables include annual mean temperature, temperature bins, seasonal temperatures, variations, and shocks. Models incorporate GDP per capita and other controls. Short- and long-run impacts are estimated, showing heterogeneity across income levels, age, and education.","Page 1: Analysis uses data from 152 countries between 1975 and 2016 to study the impact of temperature changes on obesity rates. Page 2: The study employs a panel model using data from 1975 to 2016 for 152 countries, relying on year-to-year temperature fluctuations to identify the causal effect of warming on obesity. Page 3: The baseline model utilizes a third-degree temperature polynomial to account for the nonlinear impact of temperature on obesity; 'long-difference' model relies on long-term temperature trends to identify the impact. Page 5: The study uses country-level climate measures calculated as the population-weighted average across all climate grids within each country, utilizing gridded population data from the year 2000 (LandScan Program). Page 6: Utilizes multi-model ensemble climate projections from CMIP6 for scenario analysis. Page 7: The analysis uses a fixed effects panel model, comparing the same country over time to estimate the causal effect of warming. Page 8: The methodology is described as using ""a J-degree temperature polynomial to capture the well-documented nonlinear effect of temperature"" and also incorporating ""the interaction between income and the temperature polynomial"" to assess variations in the impact. Page 9: The analysis uses a baseline model (1) to capture short-run impacts based on year-to-year temperature fluctuations. A 'long-difference' model (6) is used to capture long-run impacts using long-term temperature trends, allowing for adaptation. Page 20: ...the model includes country fixed effects to eliminate the mean temperature of the country. Page 29: We estimate the causal effect of global warming on obesity using plausibly exogenous year-to-year temperature fluctuations. ","Global warming significantly increases obesity rates in temperate zones while decreasing them in a small number of tropical countries. An estimated 1°C increase in annual mean temperature can result in approximately 79.7 million more obese adults worldwide, showing substantial heterogeneity across countries, income levels, age structures, and education levels. Men are more affected than women, with high-temperature exposure contributing to this difference. The impact of warming is larger in poorer countries and those with more educated or older populations. Short-run and long-run models suggest that long-term adaptation may not sufficiently mitigate obesity impacts in temperate zones. Seasonal warming particularly affects obesity during high-temperature seasons. Obesity is a significant pathway through which global warming influences human capital and economic outcomes.","""Global warming significantly increased obesity rates in temperate countries, with little reduction observed in tropical countries."" ""The impact of warming on obesity is higher in poorer countries, countries with older populations, and countries with more educated populations."" ""The estimates suggest that the marginal effect of warming on male obesity is roughly one-third larger than that on female obesity."" ""Warming of high-temperature seasons significantly increases obesity, while warming of low-temperature seasons has a negligible effect."" ""Obesity is an important pathway through which global warming can detrimentally affect human capital and economic outcomes."" ""The study investigates the potential of adaptation in offsetting the impact of global warming on adult obesity."" ""Long-term adaptation may not significantly mitigate the impact of global warming on obesity."" ""Global warming significantly increased obesity in most countries, except a small number of tropical countries, and highlights substantial heterogeneity across regions, income levels, age structures, and education levels."" ""Interestingly, the resulting response function closely resembles the one without the interaction effect, as seen in panel C. This suggests a limited moderating effect of income."" ""1◦C increase in annual mean temperature would increase the number of obese adults worldwide by 12.3%."" ""Positive temperature shocks initially enhance and then reduce the adult obesity rate"" and ""Finding is as expected because a greater number of months with positive temperature shocks corresponds to a higher mean temperature.""","The paper explores alternative temperature measures including temperature bins, within-year temperature variation, seasonal mean temperature, and positive temperature shocks; the seasonal model suggests only warming of high-temperature seasons increases obesity rates, which the baseline model using annual average temperature cannot capture; the study also discusses potential mechanisms through which global warming may affect obesity, including impacts on calorie intake and expenditure, and macro-level population structure.","""In robustness checks, we also measure temperature using temperature bins, within-year temperature variation, seasonal mean temperature, and positive temperature shocks."" ""The seasonal model provides additional information: it suggests that only the warming of high-temperature seasons can increase obesity rates. This aspect cannot be captured in our baseline analysis because the baseline model uses an annual average temperature measure."" ""Global warming can influence calorie intake by altering income (Burke et al. 2015), food prices (Wheeler and von Braun 2013), and consumption preferences (Scheelbeek et al. 2020). Global warming may also impact calorie expenditure by changing working hours (Graff Zivin and Neidell 2014), levels of physical activity (Obradovich and Fowler 2017), and minimum calorie requirements (Johnson and Kark 1947).""",Acute shocks,"Page 2: The study employs a panel model using data from 1975 to 2016 for 152 countries, relying on year-to-year temperature fluctuations to identify the causal effect of warming on obesity.",Adaptive,"Page 4: Source material here.
""The paper evaluates the impact of global warming on obesity...our study is the first to directly examine the overall impact of warming on obesity based on long-run global data and to evaluate the potential of long-run adaptation in offsetting this impact."" ; Page 9: Source material: ""The baseline model (1) primarily captures the short-run impact because it relies on year-to-year temperature ﬂuctuations to estimate the effect...To address this concern, we follow the literature (e.g., Moore and Lobell 2014;Burke et al. 2015; Burke and Emerick 2016;Wingetal. 2021; Liu et al. 2023) in estimating a “long-difference” model that captures the long-run impact using long-term temperature trends, As individuals have sufﬁcient time to adapt to long-term temperature trends, the long-run model is better suited to capture the beneﬁts of adaptation.""; Page 28: Source material: Given that individuals are more likely to adapt to long-term trends than to short-term fluctuations, the difference between these two models reflects the effect of adaptation. Specifically, by combining the estimated country-specific marginal effects of warming based on the short-run model with the country-level predicted warming, panel A of Fig. 14 presents the estimated short-run impact of global warming. Likewise, by combining the estimated country-specific marginal effects of warming based on the long-run model with the country-level predicted warming, panel B of Fig. 14 presents the estimated long-run impact of global warming. Finally, the difference between the estimated long-run and short-run impacts, as reported in panel C of Fig. 14, captures the potential for adaptation.; Page 29: Source material here. ""Finally, we infer the effect of long-term adaptation by comparing the baseline model with a long-difference model.""
",Global,"Page 1: Analysis uses data from 152 countries between 1975 and 2016 to study the impact of temperature changes on obesity rates.; Page 2: The study employs a panel model using data from 1975 to 2016 for 152 countries, relying on year-to-year temperature fluctuations to identify the causal effect of warming on obesity.; Page 5: The study uses country-level climate measures calculated as the population-weighted average across all climate grids within each country...",Sectoral Interactions,"Global warming can influence calorie intake by altering income (Burke et al. 2015), food prices (Wheeler and von Braun 2013), and consumption preferences (Scheelbeek et al. 2020). Global warming may also impact calorie expenditure by changing working hours (Graff Zivin and Neidell 2014), levels of physical activity (Obradovich and Fowler 2017), and minimum calorie requirements (Johnson and Kark 1947).",Transitional (accounting for changes over time),"Page 2: The study employs a panel model using data from 1975 to 2016 for 152 countries, relying on year-to-year temperature fluctuations to identify the causal effect of warming on obesity.; Page 9: The baseline model (1) primarily captures the short-run impact because it relies on year-to-year temperature ﬂuctuations to estimate the effect...To address this concern, we follow the literature (e.g., Moore and Lobell 2014;Burke et al. 2015; Burke and Emerick 2016;Wingetal. 2021; Liu et al. 2023) in estimating a “long-difference” model that captures the long-run impact using long-term temperature trends.; Page 10: The short-run model relies on year-to-year temperature variations to identify the short-term effect, while the long-run model relies on 30-year temperature trends to identify the long-term effect.; Page 28: Given that individuals are more likely to adapt to long-term trends than to short-term fluctuations, the difference between these two models reflects the effect of adaptation.",,"The analysis uses a fixed effects panel model, comparing the same country over time to estimate the causal effect of warming. It relies on inter-annual temperature fluctuations being random. The baseline model uses eight control variables: log GDP per capita and its square, annual total precipitation and its square, wet day frequency, frost day frequency, cloud cover percentage, and vapor pressure.","Adaptation is examined by comparing short-run and long-run models. Short-run models capture year-to-year temperature fluctuations, while long-run models assess 30-year trends to account for adaptation potential. Long-term adaptation is inferred through these differences, revealing that adaptation doesn't significantly mitigate global warming's impact on obesity in temperate zones. Robustness checks use temperature bins, seasonal variations, and positive temperature shocks, considering interaction effects with GDP. Overall, adaptation assessments suggest limited effectiveness in temperate regions, with socioeconomic factors considered.","The baseline model utilizes a third-degree temperature polynomial to account for the nonlinear impact of temperature on obesity. To infer the effect of long-term adaptation, we also estimate a 'long-difference' model that relies on long-term temperature trends to identify the impact. (Page 3)

Global warming is expected to have a substantial impact on human obesity... This study estimates the overall impact of global warming on adult obesity and investigates the potential of adaptation in offsetting this impact. (Page 2)

Our findings indicate that long-term adaptation may not significantly mitigate the impact of global warming on obesity in temperate zones. (Page 29)

The baseline model (1) primarily captures the short-run impact because it relies on year-to-year temperature fluctuations to estimate the effect...we follow the literature...in estimating a 'long-difference' model that captures the long-run impact using long-term temperature trends...the long-run model is better suited to capture the benefits of adaptation. (Page 9)

Finally, the difference between the estimated long-run and short-run impacts, as reported in panel C of Fig. 14, captures the potential for adaptation. It reveals that the long-run model predicts a more positive impact in temperate zones but a more negative impact in subtropical and tropical zones. (Page 28)"
