,Outcome,Country(ies),Scenario,Year,Relative to,Units,Value,SD,Low Quantile,Low Value,High Quantile,High Value,Result Source,More Notes
0,Lifetime Earnings,Philippines,No explicit scenario,2005,No CC,$ per person,1367,NA,NA,NA,NA,NA,Page 1,"A 25% reduction in early-life ozone exposure is associated with an increase in per person discounted lifetime earnings. The result scaled to a national level equates to a 2% increase of 2005 GDP, or $2.05 billion."
1,Lifetime earnings,Philippines,NA,2005,Baseline pollution exposure,USD,1367,NA,NA,NA,NA,NA,3,Increase per person if early-life pollution exposure was reduced by 25 percent.
2,Lifetime earnings,Philippines,NA,2005,Baseline pollution exposure,USD,44500000,NA,NA,NA,NA,NA,3,Increase in the province (Cebu) if early-life pollution exposure was reduced by 25 percent.
3,Lifetime earnings,Philippines,NA,2005,Baseline pollution exposure,USD,2050000000,NA,NA,NA,NA,NA,3,Increase at the national level if early-life pollution exposure was reduced by 25 percent.
4,GDP,Philippines,NA,2005,Baseline pollution exposure,%,2,NA,NA,NA,NA,NA,3,"Percentage of 2005 GDP, increase if early-life pollution exposure was reduced by 25 percent."
5,GDP,Philippines,No explicit scenario,2005,No CC,Billion USD,2.05,NA,NA,NA,NA,NA,Page 23,The GDP benefit is associated with reducing O3 exposures by 25% and represents 2% of the Philippine GDP in 2005.
