,Outcome,Region,Scenario,Year,Relative to,Units,Value,SD,Low Quantile,Low Value,High Quantile,High Value,Result Source,More Notes
0,Property Value,US Coast,Reduced Nourishment,2050,Baseline,Percent,-10,NA,NA,NA,NA,NA,Page 5,Oceanfront properties
1,Property Value,US Coast,Reduced Nourishment,2050,Baseline,Percent,-5,NA,NA,NA,NA,NA,Page 5,Non-oceanfront properties
2,Beach Width,US Coast,Reduced Nourishment,2050,Expected Beach Width,Meters,-50,NA,NA,NA,NA,NA,Page 5,Immediate decline after subsidy reduction
3,Property Value,US East/Gulf,Outside Markets,2124,Constant Markets,$,-1,NA,NA,NA,NA,NA,7,Model: property values plummet after market decline (SLR @ 2074).
4,Investor Share,US East/Gulf,Outside Markets,2154,Constant Markets,pct.,100,NA,NA,NA,NA,NA,7,Model: investors own all housing after market decline (SLR @ 2074).
