,Outcome,Region,Scenario,Year,Relative to,Units,Value,SD,Low Quantile,Low Value,High Quantile,High Value,Result Source,More Notes
0,Revenue,US West Coast,Harmful algal bloom,2015,5 year average,million USD,-97.5,NA,NA,NA,NA,NA,2460,Dungeness crab fishery. Landings reached only 52% of average catch.
1,Commercial landings,Puerto Rico,Hurricane Maria,2017,Pre-hurricane,%,-20,NA,NA,NA,NA,NA,2460,Due to loss of productive assets and power for extended periods and reduced demand.
2,Economic,Puerto Rico,Hurricane Maria,2017,Pre-hurricane,million USD,-17.8,NA,NA,NA,NA,NA,2460,Damaged fishing capital accounted for 51% of the losses and forgone fishing revenue the remaining 49%.
3,Disaster Funding,United States,Climate shocks,1989,2020,billion USD,-3.2,NA,NA,NA,NA,NA,2460,71 large-scale climate shocks have impacted fisheries and been classified as federal disasters.
4,Economic losses,Fiji,Tropical Cyclone Winston,2016,No CC,FJD,-600000000.0,NA,NA,NA,NA,NA,8,Losses due to changes in the economic flows of the production of goods and services.
5,Tourism losses,Fiji,Tropical Cyclone Winston,2016,No CC,FJD,-120000000.0,NA,NA,NA,NA,NA,8,Losses from lost tourism alone.
