,Outcome,Country(ies),Scenario,Year,Relative to,Units,Value,SD,Low Quantile,Low Value,High Quantile,High Value,Result Source,More Notes
0,Economic damages,33 European countries,1980-2017 HMHs,2017,No CC,Billion USD,0,NA,NA,NA,NA,NA,"Page 6, Fig 1","Data from Munich Re, 2019, bar graphs show economic damages in billion USD, value estimated at zero because figure is qualitative"
1,Economic damages,7 European countries,1980-2017 HMHs,2017,No CC,Billion USD,0,NA,NA,NA,NA,NA,"Page 6, Fig 1","Data from Munich Re, 2019, bar graphs show economic damages in billion USD, value estimated at zero because figure is qualitative"
2,Economic damages,Europe,Historical,2019,No CC,USD,502600000000,NA,NA,NA,NA,NA,7,Total economic losses from 1900-2019
3,Economic damages,Germany,Historical,2002,No CC,USD,12900000000,NA,NA,NA,NA,NA,7,Floods
4,Economic damages,Germany,Historical,2013,No CC,USD,7800000000,NA,NA,NA,NA,NA,7,Floods
5,Economic damages,Europe,Future,2100,Current (2020),USD,88800000000,NA,NA,NA,NA,NA,7,Expected annual economic loss by the end of the 21st century.
