,Outcome,Country(ies),Scenario,Year,Relative to,Units,Value,SD,Low Quantile,Low Value,High Quantile,High Value,Result Source,More Notes
0,GDP,Egypt,NA,2020,No CC,NA,1.375079,0.585977,NA,NA,NA,NA,Page 7,Coefficient for LGDITOTL in the ARDL model. Gross capital formation (LGDITOTL) is identified as an important macroeconomic indicator.
1,GDP,Egypt,NA,2020,No CC,NA,1.614649,0.547698,NA,NA,NA,NA,Page 7,Coefficient for LGDITOTL (-2) in the ARDL model. Gross capital formation (LGDITOTL) is identified as an important macroeconomic indicator.
2,International Tourism,Egypt,NA,2020,No CC,coefficient,-0.314565,0.162814,NA,NA,NA,NA,385,Long run coefficient for LCO2 (log of CO2 emissions). Significant inverse relationship between international tourism and carbon dioxide emissions.
3,Gross Capital Formation,Egypt,NA,2020,No CC,coefficient,1.578827,0.303928,NA,NA,NA,NA,385,Long run coefficient for LGDITOTL (log of gross capital formation). Strong and significant positive relationship between international tourism and gross capital formation
4,Arable Land,Egypt,NA,2020,No CC,coefficient,1.262658,0.625800,NA,NA,NA,NA,385,Long run coefficient for LLAND (log of arable land percentage). Strong and significant positive relationship between international tourism and arable land percentage
5,Tourism Revenue,Egypt,Unspecified,2020,No CC,%,-1.835255,0.207125,NA,NA,NA,NA,9,"Coefficient for CointEq (-1) in ECM, suggesting a negative long-term impact of climate change indicators."
6,Tourism Revenue,Egypt,NA,2020,Capital Formation,%,1.37,NA,NA,NA,NA,NA,10,A 1% increase in capital formation increases tourism revenues by 1.37%. The year 2020 is chosen to reflect the end of the data period (1990-2020).
